,title,publication_date,viewCount,likeCount,dislikeCount,favoriteCount,commentCount
244,AWS Certified Solutions Architect - Associate 2020 (PASS THE EXAM!),2019-12-23T16:56:34Z,1363964,29081,202,0,1474
245,APIs for Beginners - How to use an API (Full Course / Tutorial),2019-12-17T14:55:29Z,1762721,47893,640,0,1455
246,Learn Unreal Engine (with C++) - Full Course for Beginners,2019-12-09T16:37:21Z,485280,15566,308,0,687
247,"Plan, Code, and Deploy a Startup in 2 Hours [Full Stack JavaScript Tutorial]",2019-11-26T13:58:05Z,139021,4113,50,0,133
248,Quincy Interviews Open Source Legends The Changelog for their 10 Year Anniversary,2019-11-21T17:51:43Z,10520,317,7,0,22
249,Tkinter Course - Create Graphic User Interfaces in Python Tutorial,2019-11-19T13:43:26Z,1525377,33970,454,0,1819
250,React Native Browser Editor Part 2  (P8D3) - Live Coding with Jesse,2019-11-15T13:58:30Z,16391,359,14,0,18
251,What are JSON Web Tokens? JWT Auth Explained [Tutorial],2019-11-12T14:12:45Z,61937,1289,16,0,49
252,Learn Python by Building Five Games - Full Course,2019-11-06T18:00:24Z,1232712,33125,328,0,1797
253,Android Development Course - Build Native Apps with Kotlin Tutorial,2019-10-29T13:18:47Z,189175,4317,105,0,128
254,AWS Certified Cloud Practitioner Training 2020 - Full Course,2019-10-24T13:00:00Z,1721993,27251,325,0,1859
255,Pygame Tutorial for Beginners - Python Game Development Course,2019-10-22T16:26:08Z,1054730,22605,445,0,2641
256,CSS Tutorial - Zero to Hero (Complete Course),2019-10-16T15:16:56Z,1390798,32306,401,0,1372
257,Learn Bootstrap by creating a custom admin theme - Intermediate Tutorial,2019-10-14T15:18:32Z,107826,2355,53,0,89
258,Algorithms Course - Graph Theory Tutorial from a Google Engineer,2019-10-09T15:52:04Z,926462,28814,169,0,533
259,Build 5 Dapps on the Ethereum Blockchain - Beginner Tutorial,2019-10-07T15:49:48Z,88327,2443,34,0,165
260,Netlify Tutorial - How to build and deploy websites using Netlify,2019-10-03T13:43:19Z,50979,1094,22,0,60
261,React and APIs - Full Tutorial - Hacker News API Application,2019-10-01T13:31:18Z,44332,924,13,0,47
262,TensorFlow 2.0 Crash Course,2019-09-26T14:53:25Z,449790,10083,249,0,518
263,Data Structures Easy to Advanced Course - Full Tutorial from a Google Engineer,2019-09-19T14:39:38Z,3047807,73947,727,0,1687
264,Introduction To Responsive Web Design - HTML & CSS Tutorial,2019-09-18T16:19:03Z,555174,15823,122,0,521
265,Sass Tutorial for Beginners - CSS With Superpowers,2019-09-09T12:46:21Z,346373,8917,95,0,335
266,CEO can code? Watch Netlify's CEO code a Sudoku app from scratch in a bar on a Saturday night,2019-09-06T13:49:10Z,54313,995,20,0,74
267,How to start a coding YouTube channel (with tips from a bunch of successful creators!),2019-09-04T15:36:35Z,105422,4819,57,0,327
268,Spring Boot Tutorial for Beginners (Java Framework),2019-09-03T13:06:17Z,799954,13137,386,0,665
269,jamovi for Data Analysis - Full Tutorial,2019-08-29T14:47:22Z,55588,983,16,0,44
270,"Intermediate React Tutorial - Todoist Clone (with Firebase, Custom Hooks, SCSS, React Testing)",2019-08-27T12:17:33Z,125805,3376,44,0,257
271,Scratch Tutorial for Beginners - Make a Flappy Bird Game,2019-08-21T14:17:17Z,143492,1909,118,0,169
272,How to Build an E-commerce Website with Django and Python,2019-08-19T13:58:02Z,773717,14158,225,0,530
273,Docker Tutorial for Beginners - A Full DevOps Course on How to Run Applications in Containers,2019-08-16T13:48:15Z,1382614,26010,302,0,834
274,How to Build Tetris in React - GameDev Tutorial (with React Hooks!),2019-08-14T15:42:08Z,95242,2436,36,0,180
275,Learn Angular Material - Full Tutorial,2019-08-13T14:19:32Z,188479,3508,51,0,127
276,Python NumPy Tutorial for Beginners,2019-08-07T13:00:04Z,396784,11073,121,0,244
277,Kotlin Programming Fundamentals Tutorial - Full Course,2019-08-05T13:00:04Z,71406,1882,25,0,84
278,In-Depth React Tutorial: Build a Hotel Reservation Site (with Contentful and Netlify),2019-08-02T13:01:14Z,256037,6532,62,0,226
279,Full Ethical Hacking Course - Network Penetration Testing for Beginners (2019),2019-07-29T15:14:39Z,4270357,153192,1346,0,4945
280,Svelte Tutorial - Is it better than React?,2019-07-26T14:20:03Z,42549,979,20,0,92
281,Dart Programming Tutorial - Full Course,2019-07-24T15:30:19Z,404158,7711,331,0,486
282,Godot Game Engine Tutorial - Make a 2D Platformer Game,2019-07-22T15:17:27Z,51359,913,56,0,66
283,"Solidity Tutorial - A Full Course on Ethereum, Blockchain Development, Smart Contracts, and the EVM",2019-07-19T14:15:25Z,277386,6390,111,0,256
284,"React Hooks Tutorial - A Crash Course on Styled Components, JSX, React Router, and HOC",2019-07-17T15:21:26Z,43161,991,29,0,37
285,Deep Reinforcement Learning in Python Tutorial - A Course on How to Implement Deep Learning Papers,2019-07-16T14:18:51Z,42988,1162,12,0,38
286,Intermediate React and Firebase Tutorial - Build an Evernote Clone,2019-07-15T13:15:00Z,70081,1735,42,0,100
287,Kotlin Course - Tutorial for Beginners,2019-07-12T13:11:25Z,699693,13842,184,0,938
288,Learn GraphQL with Laravel and Vue.js - Full Tutorial,2019-07-10T14:40:28Z,46331,1078,16,0,47
289,Getting Started with Node.js - Full Tutorial,2019-07-08T13:30:46Z,118114,2481,42,0,74
290,Linux for Ethical Hackers (Kali Linux Tutorial),2019-07-05T16:33:36Z,2186870,48695,926,0,2059
291,Flutter Course - Full Tutorial for Beginners (Build iOS and Android Apps),2019-07-03T14:19:40Z,554910,10909,306,0,310
292,Data Visualization with D3.js - Full Tutorial Course,2019-07-01T12:43:02Z,573145,12927,132,0,289
293,Build Your First Blockchain App Using Ethereum Smart Contracts and Solidity,2019-06-28T13:09:23Z,358330,9239,140,0,650
294,"Learn the MERN Stack - Full Tutorial (MongoDB, Express, React, Node.js)",2019-06-25T12:05:54Z,874686,17209,327,0,1336
295,Full Stack React & Firebase Tutorial - Build a social media app,2019-06-24T12:36:39Z,816417,21572,139,0,1847
296,Learn Go Programming - Golang Tutorial for Beginners,2019-06-20T12:39:54Z,1096372,23381,225,0,973
297,Learn Webpack - Full Tutorial for Beginners,2019-06-19T14:44:14Z,182535,5237,67,0,411
298,Run freeCodeCamp Locally  (P8D2) - Live Coding with Jesse,2019-06-18T12:47:33Z,14794,286,14,0,14
299,Penetration Testing: Gophish Tutorial (Phishing Framework),2019-06-17T14:00:58Z,88207,1329,92,0,115
300,Statistics - A Full University Course on Data Science Basics,2019-06-12T14:59:55Z,861691,21560,266,0,570
301,"AWS AppSync Tutorial - GraphQL APIs with AppSync, Amplify and Angular",2019-06-11T14:08:40Z,32297,521,19,0,28
302,Intro to HTML & CSS - Tutorial,2019-06-10T20:16:56Z,58341,1269,47,0,62
303,React Native Browser Editor  (P8D1) - Live Coding with Jesse,2019-06-10T13:27:02Z,13498,303,7,0,29
304,R Programming Tutorial - Learn the Basics of Statistical Computing,2019-06-06T14:12:38Z,1685129,28601,875,0,984
305,Learn Data Science Tutorial - Full Course for Beginners,2019-05-30T12:48:19Z,1381608,34634,522,0,811
306,Learn Flask for Python - Full Tutorial,2019-05-28T12:43:15Z,752297,12955,316,0,1008
307,E-Commerce JavaScript Tutorial - Shopping Cart from Scratch,2019-05-24T17:37:26Z,257505,6330,83,0,292
308,Intro to Java Programming - Course for Absolute Beginners,2019-05-21T16:24:34Z,858026,16047,296,0,551
309,Ionic Framework 4 - Full Tutorial - iOS / Android App Development,2019-05-17T13:18:30Z,186036,2582,76,0,100
310,The Great Gatsby Bootcamp - Full Gatsby.js Tutorial Course,2019-05-15T14:00:16Z,73849,1772,22,0,163
311,Reinforcement Learning Course - Full Machine Learning Tutorial,2019-05-14T12:19:37Z,118328,2868,84,0,107
312,Symfony PHP Framework Tutorial - Full Course,2019-05-09T13:34:13Z,203569,2509,61,0,212
313,Code a magic card trick using JavaScript & Node.js - Tutorial,2019-05-08T14:58:16Z,25692,608,10,0,28
314,Laravel PHP Framework Tutorial - Full Course for Beginners (2019),2019-05-07T12:39:04Z,1382645,20762,332,0,2260
315,Python for Everybody - Full University Python Course,2019-05-02T12:05:54Z,2584613,81155,686,0,3031
316,React Native Web Styling Part 2  (P7D13) - Live Coding with Jesse,2019-05-01T12:42:02Z,8515,121,4,0,6
317,Learn HTML5 and CSS3 From Scratch - Full Course,2019-04-30T16:50:28Z,2630673,60101,640,0,2732
318,APIs in React Tutorial - Recipe App using React Router,2019-04-25T15:01:06Z,36487,880,11,0,70
319,React Native Web Styling  (P7D12) - Live Coding with Jesse,2019-04-24T12:47:31Z,7922,166,7,0,5
320,Django Rest Framework & React Tutorial: Learning Management System (Blackboard / Moodle Clone),2019-04-23T12:27:02Z,122170,1993,36,0,78
321,Learn Regular Expressions (Regex) - Crash Course for Beginners,2019-04-18T15:04:25Z,83081,2196,27,0,122
322,React Native Web Math Game Dev  (P7D11) - Live Coding with Jesse,2019-04-17T12:41:29Z,8547,197,4,0,4
323,How Deep Neural Networks Work - Full Course for Beginners,2019-04-16T15:58:13Z,150543,2858,59,0,84
324,MASTER your coding interview,2019-04-12T13:27:13Z,81287,2205,35,0,72
325,React Native Web Testing Part 2 (P7D10) - Live Coding with Jesse,2019-04-10T12:45:21Z,6007,130,5,0,3
326,Dropbox API / JavaScript ES6 Tutorial - Expense Organizer,2019-04-09T13:43:16Z,25002,490,9,0,21
327,Learn PostgreSQL Tutorial - Full Course for Beginners,2019-04-04T14:00:12Z,866815,18132,263,0,1185
328,React Native Web Testing (P7D9) - Live Coding with Jesse,2019-04-03T13:00:34Z,7589,154,6,0,16
329,ReasonML Programming - Full Course for Beginners,2019-04-02T13:57:11Z,28209,684,13,0,34
330,Develop an AI to play Connect Four - Python Tutorial,2019-03-29T13:53:52Z,67087,861,16,0,50
331,Python Online Multiplayer Game Development Tutorial,2019-03-27T15:06:33Z,195559,4685,67,0,276
332,React Native Web Deployment (P7D8) - Live Coding with Jesse,2019-03-27T13:44:54Z,8371,165,3,0,14
333,Create a C# Application from Start to Finish - Complete Course,2019-03-25T12:45:35Z,1247096,29765,325,0,1333
334,React Native with Hooks (P7D7) - Live Coding with Jesse,2019-03-22T13:22:36Z,7996,148,6,0,1
335,2d Game Dev Unity Tutorial - Hyper Casual Game,2019-03-21T14:33:13Z,39048,918,36,0,37
336,React Native Web Game Styles  (P7D6) - Live Coding with Jesse,2019-03-20T13:31:49Z,7470,148,6,0,4
337,Learn Vue.js - Full Course for Beginners - 2019,2019-03-19T15:15:00Z,837329,12082,235,0,798
338,React Native Web Game Logic Part 2  (P7D5) - Live Coding with Jesse,2019-03-15T13:32:10Z,7628,156,2,0,2
339,"React Native Web Full App Tutorial - Build a Workout App for iOS, Android, and Web",2019-03-13T15:07:42Z,247199,3307,64,0,123
340,How to Make a Custom Website from Scratch using WordPress (Theme Development) - 2019 Tutorial,2019-03-11T17:26:27Z,393773,7794,133,0,357
341,React Native Web Game Logic  (P7D4) - Live Coding with Jesse,2019-03-08T14:26:30Z,10572,236,5,0,4
342,How to Code Like a Pro (with Dylan Israel),2019-03-07T18:17:32Z,113885,2731,81,0,101
343,React Native Web UI Building  (P7D3) - Live Coding with Jesse,2019-03-06T14:28:40Z,9572,194,0,0,12
344,Intro to Data Science - Crash Course for Beginners,2019-03-04T18:20:37Z,178457,3613,63,0,105
345,React Native Web Setup Part 2 (P7D2) - Live Coding with Jesse,2019-03-01T14:24:48Z,11534,241,8,0,16
346,Foundation CSS Framework Tutorial - Crash Course for Beginners,2019-02-27T16:04:27Z,47925,734,61,0,34
347,Unity 3D Tutorial - Beat Em Up Fight Game,2019-02-25T17:02:21Z,113993,2363,55,0,118
348,MongoDB with Python Crash Course - Tutorial for Beginners,2019-02-21T15:53:46Z,147620,2586,62,0,80
349,Python Algorithms for Interviews,2019-02-19T13:52:50Z,271881,6465,124,0,278
350,Valve developers discuss Portal problems  - CS50's Intro to Game Development,2019-02-13T14:52:25Z,25666,854,5,0,58
351,Express.js & Node.js Course for Beginners - Full Tutorial,2019-02-12T19:49:51Z,229387,3477,99,0,181
352,Portal Clone Tutorial in Unity - CS50's Intro to Game Development,2019-02-12T14:52:47Z,18309,364,6,0,11
353,Dreadhalls | Unity 3D Tutorial - CS50's Intro to Game Development,2019-02-11T13:54:07Z,8293,173,3,0,7
354,Unity / C# Tutorial | Helicopter Game 3D - CS50's Intro to Game Development,2019-02-08T15:49:02Z,25806,571,9,0,25
355,Pokémon Coding Tutorial - CS50's Intro to Game Development,2019-02-07T14:58:04Z,80099,1625,16,0,57
356,Angry Birds Coding Tutorial - CS50's Intro to Game Development,2019-02-06T15:53:03Z,24646,385,13,0,23
357,Legend of Zelda Coding Tutorial - CS50's Intro to Game Development,2019-02-05T14:25:07Z,25091,578,13,0,32
358,Super Mario Bros Programming Tutorial - CS50's Intro to Game Development,2019-02-04T15:02:00Z,67535,1091,30,0,39
359,Match 3 (Lua Tutorial) - CS50's Intro to Game Development,2019-02-03T16:00:01Z,12265,205,4,0,11
360,Breakout (Lua Tutorial) - CS50's Intro to Game Development,2019-02-02T16:30:46Z,12847,247,6,0,29
361,Flappy Bird (with Lua) - CS50's Intro to Game Development,2019-02-01T14:25:38Z,32820,578,9,0,44
362,Applied Deep Learning with PyTorch - Full Course,2019-01-31T18:02:49Z,132081,2750,38,0,113
363,Pong (with Lua) - CS50's Intro to Game Development,2019-01-31T16:04:01Z,72683,1056,18,0,82
364,SQL - Intro to Computer Science - Harvard's CS50 (2018),2019-01-30T16:19:02Z,106196,2275,27,0,79
365,Tableau for Data Science and Data Visualization - Crash Course Tutorial,2019-01-29T17:38:12Z,382507,5489,100,0,128
366,Web Programming with Flask - Intro to Computer Science - Harvard's CS50 (2018),2019-01-29T14:05:46Z,165619,3787,32,0,122
367,Python - Intro to Computer Science - Harvard's CS50 (2018),2019-01-28T15:40:42Z,348531,7144,90,0,250
368,"HTTP, HTML, CSS - Intro to Computer Science - Harvard's CS50 (2018)",2019-01-27T16:00:04Z,102870,2595,17,0,93
369,Data Structures - Intro to Computer Science - Harvard's CS50 (2018),2019-01-26T16:00:05Z,89692,1654,22,0,59
370,Memory - Intro to Computer Science - Harvard's CS50 (2018),2019-01-25T16:46:04Z,81425,1494,19,0,84
371,Arrays and Sorting Algorithms - Intro to Computer Science - Harvard's CS50 (2018),2019-01-24T17:17:44Z,109108,1928,18,0,115
372,C Programming Language - Intro to Computer Science - Harvard's CS50 (2018),2019-01-23T19:27:22Z,304390,6237,81,0,254
373,React Tutorial: Weather App with RESTful APIs,2019-01-23T14:57:03Z,32432,558,10,0,26
374,Computational Thinking & Scratch - Intro to Computer Science - Harvard's CS50 (2018),2019-01-22T19:29:20Z,376998,7101,54,0,252
375,Unity FPS Survival Game Tutorial - First Person Shooter Game Dev,2019-01-21T19:39:45Z,473246,11207,238,0,813
376,React Native Web Setup (P7D1) - Live Coding with Jesse,2019-01-18T14:49:15Z,30983,309,38,0,22
377,Create a Keylogger with Python - Tutorial,2019-01-17T14:46:47Z,218864,5068,104,0,454
378,Improve Cybersecurity Skills with CTFs - PicoCTF Walkthrough (2018),2019-01-16T14:18:08Z,197722,4785,45,0,129
379,React Tutorial: Build an e-commerce site from scratch using React and Netlify,2019-01-15T17:03:42Z,422533,7064,103,0,366
380,Async/Await - JavaScript Tutorial,2019-01-10T19:16:48Z,44777,1127,32,0,53
381,Swift Tutorial - Full Course for Beginners,2019-01-09T15:28:29Z,385067,5744,88,0,214
382,Neural Networks with JavaScript - Full Course using Brain.js,2019-01-07T14:36:15Z,77137,1827,21,0,68
383,Beautiful Soup Tutorial - Web Scraping in Python,2019-01-04T15:38:26Z,249572,4753,95,0,264
384,Web Developer Portfolio Review and Tips - Nisar,2019-01-03T17:24:59Z,13636,331,16,0,31
385,Python Django Web Framework - Full Course for Beginners,2019-01-02T17:22:07Z,2411580,33356,850,0,1618
386,How to make a 3d fight game in Unity - full tutorial,2018-12-31T14:46:43Z,58933,1032,37,0,85
387,MongoDB Tutorial - CRUD app from scratch using Node.js,2018-12-28T15:08:40Z,130192,1984,65,0,119
388,CSS Full Course - Includes Flexbox and CSS Grid Tutorials,2018-12-27T17:34:04Z,550771,11400,286,0,396
389,Javascript Project Tutorial: Budget App,2018-12-21T16:29:53Z,171396,3536,49,0,140
390,Python Game Tutorial: Pong,2018-12-19T15:48:38Z,372679,6526,122,0,1327
391,Learn React JS - Full Course for Beginners - Tutorial 2019,2018-12-18T16:21:19Z,2611521,39494,402,0,2218
392,Vue.js & Firebase Tutorial - Real-time Chat,2018-12-17T19:45:55Z,49351,722,54,0,42
393,Weather App - Django Tutorial (Using Python Requests),2018-12-14T16:16:09Z,40469,765,12,0,41
394,How I Landed My Dream Software Job in 12 Months,2018-12-13T16:12:19Z,25419,598,15,0,34
395,Ethical Hacking 101: Web App Penetration Testing - a full course for beginners,2018-12-12T17:44:09Z,991957,22932,324,0,538
396,Unity Game Dev Full Tutorial: Infinite Runner,2018-12-11T17:07:30Z,33394,589,26,0,21
397,Learn JavaScript - Full Course for Beginners,2018-12-10T14:13:40Z,6490975,128072,1817,0,6051
398,JavaScript Project Tutorial: Shopping Cart,2018-12-07T18:29:10Z,124131,2089,42,0,79
399,How to Get Started in Web Development,2018-12-06T19:23:23Z,16283,492,12,0,19
400,Interview Tips from a Senior Software Engineer... and a 4 year old,2018-12-06T15:39:54Z,10552,264,48,0,35
401,Python and Pygame Tutorial - Build Tetris! Full GameDev Course,2018-12-05T17:37:45Z,160526,2265,75,0,141
402,Everyone is a Developer - Talk by Jessica Lord,2018-12-04T20:11:15Z,7339,175,17,0,14
403,Learn Node.js - Full Tutorial for Beginners,2018-12-04T15:17:49Z,740308,10309,218,0,479
404,Learn JSON - Full Crash Course for Beginners,2018-12-03T17:10:01Z,78904,3041,26,0,146
405,The All Powerful Front End Developer - Chris Coyier,2018-11-30T14:26:36Z,19337,596,5,0,20
406,Native Android App Tutorial: WhatsApp Clone,2018-11-29T16:06:02Z,522227,13320,327,0,376
407,My Google Job Interview,2018-11-28T17:14:11Z,60066,1138,52,0,124
408,Hacking Web Performance,2018-11-27T20:00:08Z,11944,339,5,0,8
409,What do computer programmers actually do?,2018-11-27T15:03:33Z,36252,795,105,0,60
410,Using a Public API - Tutorial for Beginners,2018-11-26T21:15:00Z,44963,907,36,0,44
411,Unity Game Dev Full Tutorial - 3D Snake Game,2018-11-23T15:20:42Z,69758,1034,57,0,58
412,Create a Platformer Game with JavaScript - Full Tutorial,2018-11-21T15:27:13Z,357291,6841,148,0,221
413,React Beginners Tutorial - Build an Autocomplete Text Box,2018-11-20T20:20:49Z,73506,1077,15,0,60
414,7 Habits of Successful Software Engineers,2018-11-19T15:55:33Z,71937,2210,120,0,116
415,npm Tutorial for Beginners,2018-11-16T17:39:13Z,41828,852,75,0,34
416,Hackathon Live Demos from the 2018 freeCodeCamp JAMstack Hackathon top 7 teams,2018-11-15T19:56:38Z,11649,121,6,0,10
417,"The History of Cryptography: Block Cyphers, Stream Cyphers, Public Keys and more!",2018-11-15T14:49:50Z,6205,181,1,0,11
418,Theory of Neural Networks - Deep Learning Without Frameworks,2018-11-14T20:49:23Z,32555,804,13,0,37
419,How to Build a Discord Bot - Full JavaScript Chatbot Tutorial,2018-11-14T15:43:56Z,101348,2220,47,0,393
420,Learn TensorFlow.js - Deep Learning and Neural Networks with JavaScript,2018-11-13T16:14:02Z,118773,2519,54,0,105
421,Resume Review: Front-end Web Developer (Waqar),2018-11-12T14:58:24Z,20600,252,4,0,16
422,"Web Development Tutorial - JavaScript,  HTML, CSS - Rock Paper Scissors Game",2018-11-09T17:28:22Z,778374,19349,361,0,948
423,Kubernetes: A Developer's Guide to Orchestrating Containers,2018-11-09T15:42:02Z,14787,265,5,0,5
424,Computer Science Terminology,2018-11-08T18:16:56Z,89684,3471,60,0,128
425,Beat Asteroids Game Using a Neural Network - JavaScript Tutorial,2018-11-07T14:58:14Z,18928,496,6,0,27
426,Learn Angular - Full Tutorial Course,2018-11-06T18:52:22Z,583632,7770,219,0,253
427,Writing Code like a Real Hacker (VS Code Macro Extension),2018-11-06T14:57:29Z,404543,8142,513,0,318
428,Using icons on the web with Ionicons,2018-11-05T17:15:32Z,14940,310,5,0,24
429,Intro to Node.js and npm,2018-11-02T20:00:04Z,10871,245,4,0,3
430,Connect Four Python Game Tutorial with pygame,2018-11-02T15:45:01Z,56822,777,9,0,64
431,Debugging JavaScript - Are you doing it wrong?,2018-11-01T19:45:00Z,18322,788,7,0,37
432,Introduction to Front End Testing,2018-11-01T15:00:00Z,15003,316,8,0,11
433,Getting Your First Developer Job,2018-10-31T18:00:03Z,18732,620,23,0,63
434,Snake Game Python Tutorial,2018-10-31T14:17:55Z,476937,5107,290,0,428
435,Live ReactJS Coding (P5D102) - Live Coding with Jesse,2018-10-29T19:20:36Z,9187,155,3,0,23
436,Easily Build an Airbnb Clone with Sharetribe - Tutorial,2018-10-29T15:24:35Z,17400,187,25,0,24
437,Simon Game JavaScript Tutorial for Beginners,2018-10-26T17:21:57Z,50462,1037,8,0,71
438,How to stream on YouTube using OBS - in-depth OBS tutorial,2018-10-26T15:26:04Z,4285,148,3,0,5
439,Let’s Build a Tinder-Like Swipe Carousel,2018-10-25T19:52:01Z,6061,146,3,0,11
440,Gatsby - Full Tutorial for Beginners,2018-10-23T14:40:15Z,51439,1027,47,0,54
441,Create a Kanban Board,2018-10-19T14:44:46Z,34961,704,40,0,37
442,Tweet Visualization and Sentiment Analysis in Python - Full Tutorial,2018-10-18T15:09:56Z,151489,2614,33,0,197
443,Intro to Computer Networks - Crash Course,2018-10-17T15:56:48Z,44275,1072,34,0,31
444,Protected Routes in React using React Router,2018-10-16T16:00:05Z,224460,4267,101,0,193
445,Building React Components (P5D101) - Live Coding with Jesse,2018-10-15T16:31:11Z,5883,106,5,0,3
446,HTML and CSS Tutorial - Create a Website for Beginners,2018-10-15T15:35:32Z,321960,6050,78,0,281
447,The History of JavaScript: a timeline of programming language evolution over the past 20 years,2018-10-12T16:07:21Z,12630,245,11,0,20
448,Intro to Game Development with JavaScript - Full Tutorial,2018-10-11T14:56:55Z,385555,7964,123,0,589
449,CSS Coffee Cup: CSS Tutorial (Day 30 of CSS3 in 30 Days),2018-10-10T19:00:02Z,20592,412,6,0,36
450,Blurry Effect: CSS Tutorial (Day 29 of CSS3 in 30 Days),2018-10-09T19:00:01Z,10820,198,2,0,12
451,JavaScript Classes Tutorial,2018-10-09T13:43:03Z,115015,2472,36,0,151
452,Optimizing CSS: CSS Tutorial (Day 28 of CSS3 in 30 Days),2018-10-08T19:06:08Z,10804,243,11,0,16
453,Creating a Progressive Web App Manifest (P5D100) - Live Coding with Jesse,2018-10-08T16:18:20Z,6657,161,3,0,13
454,CSS Only Dropdown Menu: CSS Tutorial (Day 27 of CSS3 in 30 Days),2018-10-07T20:18:39Z,15042,372,18,0,29
455,3d Layer Effect: CSS Tutorial (Day 26 of CSS3 in 30 Days),2018-10-06T21:39:21Z,23184,722,9,0,29
456,Sliding Panels: CSS Tutorial (Day 25 of CSS3 in 30 Days),2018-10-05T20:30:45Z,17700,338,2,0,14
457,"GraphQL Server Intermediate Tutorial - Boilerplate with Typescript, PostgreSQL, and Redis",2018-10-05T13:47:38Z,30679,701,14,0,21
458,@supports Rule: CSS Tutorial (Day 24 of CSS3 in 30 Days),2018-10-04T18:43:13Z,6120,123,4,0,7
459,Accordion: CSS Tutorial (Day 23 of CSS3 in 30 Days),2018-10-03T19:55:53Z,8472,198,4,0,12
460,"How To Write User Stories, Epics, & Personas - Dev Life",2018-10-03T14:37:50Z,30397,1057,24,0,33
461,Flexbox Layouts: CSS Tutorial (Day 22 of CSS3 in 30 Days),2018-10-02T19:21:11Z,11127,254,5,0,17
462,Spinners: CSS Tutorial (Day 21 of CSS3 in 30 Days),2018-10-01T19:42:08Z,9219,241,5,0,16
463,Maths for Programmers Tutorial - Full Course on Sets and Logic,2018-10-01T15:56:05Z,461740,16059,146,0,425
464,Animated Pyramid: CSS Tutorial (Day 20 of CSS3 in 30 Days),2018-09-30T18:45:00Z,9139,246,4,0,22
465,Animated Progress Bars: CSS Tutorial (Day 19 of CSS3 in 30 Days),2018-09-29T22:01:12Z,17448,379,2,0,19
466,Useful Tooltips: CSS Tutorial (Day 18 of CSS3 in 30 Days),2018-09-28T17:51:41Z,12508,299,2,0,17
467,2018 Top Contributor Party in Dublin - Highlights and Interviews,2018-09-28T14:33:10Z,1502,48,1,0,2
468,Pacman & Ghost Animation: CSS Tutorial (Day 17 of CSS3 in 30 Days),2018-09-27T19:00:00Z,13674,331,2,0,21
469,React Project Post Launch Recap with Q&A (P5D99) - Live Coding with Jesse,2018-09-27T18:33:14Z,3425,84,1,0,5
470,Natural Language Processing (NLP) Tutorial with Python & NLTK,2018-09-27T17:13:32Z,143821,2162,76,0,96
471,How to Speak the Language of Application Architecture,2018-09-27T14:28:02Z,12301,241,4,0,3
472,Modal Window: CSS Tutorial (Day 16 of CSS3 in 30 Days),2018-09-26T19:15:01Z,11083,300,5,0,9
473,Using Parcel Bundler with React,2018-09-26T16:27:08Z,8055,216,5,0,30
474,Get Productive with Python in Visual Studio Code,2018-09-26T14:55:44Z,37051,729,7,0,26
475,Sticky Sidebar: CSS Tutorial (Day 15 of CSS3 in 30 Days),2018-09-25T20:05:03Z,21849,372,24,0,11
476,CSS Crash Course Tutorial,2018-09-25T17:04:22Z,48589,1468,20,0,48
477,Build Better and Discoverable APIs with GraphQL,2018-09-25T13:58:38Z,3896,91,2,0,3
478,Sticky Header: CSS Tutorial (Day 14 of CSS3 in 30 Days),2018-09-24T19:15:00Z,12165,218,5,0,19
479,What is a Daily Standup? - Dev Life,2018-09-24T17:10:31Z,10654,400,15,0,29
480,The Art of Web API Design,2018-09-24T14:40:17Z,13877,306,6,0,6
481,Sticky Footer: CSS Tutorial (Day 13 of CSS3 in 30 Days),2018-09-23T18:00:02Z,16411,326,9,0,22
482,Top Contributors 2018 Party in Dublin for freeCodeCamp.org,2018-09-22T21:36:59Z,3494,94,1,0,3
483,CSS Variables: CSS Tutorial (Day 12 of CSS3 in 30 Days),2018-09-22T18:00:02Z,8646,196,6,0,12
484,Using Algolia Search with React (P5D98) - Live Coding with Jesse,2018-09-21T20:33:58Z,6275,107,5,0,14
485,Internet Explorer Hacks: CSS Tutorial (Day 11 of CSS3 in 30 Days),2018-09-21T18:45:00Z,11132,185,4,0,10
486,Amazon CloudWatch: Serverless Logging and Monitoring Basics,2018-09-21T16:30:11Z,2621,62,5,0,4
487,How to Become a Developer,2018-09-21T12:09:28Z,73799,2724,27,0,106
488,Pricing Table: CSS Tutorial (Day 10 of CSS3 in 30 Days),2018-09-20T18:45:00Z,12537,260,2,0,9
489,How to use TypeScript in React,2018-09-20T16:36:02Z,13657,258,17,0,15
490,How I hacked my friend without her noticing - Operation Luigi,2018-09-20T14:16:03Z,27957,888,32,0,43
491,Modern Layouts: CSS Tutorial (Day 9 of CSS3 in 30 Days),2018-09-19T19:30:01Z,15442,284,21,0,18
492,How do computers and the internet work? - Computer Science Basics,2018-09-19T16:27:42Z,62014,1444,24,0,73
493,How not to become a senior developer (and what to do instead),2018-09-19T15:25:29Z,11032,238,15,0,9
494,8-Bit Mario: CSS Tutorial (Day 8 of CSS3 in 30 Days),2018-09-18T18:53:53Z,15883,309,7,0,16
495,HTML Full Course - Build a Website Tutorial,2018-09-18T17:02:21Z,3723343,96653,1241,0,4628
496,"Web Workers, Service Workers, and PWAs",2018-09-18T14:03:20Z,7217,155,5,0,3
497,Image Manipulation: CSS Tutorial (Day 7 of CSS3 in 30 Days),2018-09-17T19:30:55Z,13110,263,1,0,7
498,Live React Coding Part 4 (P5D97) - Live Coding with Jesse,2018-09-17T19:12:12Z,4130,102,1,0,3
