,title,publication_date,viewCount,likeCount,dislikeCount,favoriteCount,commentCount
0,What is Binary Search?,2021-07-07T13:00:17Z,9503,691,12,0,53
1,Certified Information Security Professional (CISSP) Certification Course - PASS the Exam!,2021-07-06T13:00:08Z,28791,2040,18,0,127
2,Python Backend Web Development Course (with Django),2021-07-01T16:51:03Z,108911,6013,57,0,222
3,React Router Crash Course,2021-06-30T13:59:48Z,25856,1006,18,0,65
4,Microsoft Security Compliance and Identity (SC-900) - Full Course PASS the Exam,2021-06-29T13:22:19Z,16466,642,10,0,31
5,Create a Design System with Figma - Full Course,2021-06-28T13:50:27Z,71661,3582,25,0,99
6,OpenTelemetry Course - Understand Software Performance,2021-06-24T12:23:42Z,72258,2208,38,0,116
7,.NET 5 REST API Tutorial - Build From Scratch With C#,2021-06-23T14:17:06Z,76417,3032,20,0,131
8,"Asynchronous JavaScript Course (Async/Await, Promises, Callbacks)",2021-06-22T14:53:30Z,46839,2532,41,0,131
9,JavaScript Programming - Full Course,2021-06-21T16:42:15Z,156917,8796,44,0,426
10,Understanding Sorting Algorithms,2021-06-18T13:06:56Z,48778,2268,39,0,105
11,Azure AI Fundamentals Certification (AI-900) - Full Course to PASS the Exam,2021-06-17T12:02:41Z,28311,1113,18,0,77
12,Data Analytics Crash Course: Teach Yourself in 30 Days,2021-06-16T13:55:43Z,116630,4605,51,0,123
13,DevOps Engineering Course for Beginners,2021-06-15T14:21:35Z,117946,4746,43,0,116
14,Azure Data Fundamentals Certification (DP-900) - Full Course to PASS the Exam,2021-06-10T11:34:01Z,49483,1774,10,0,97
15,Learn Bootstrap 5 and SASS by Building a Portfolio Website - Full Course,2021-06-09T15:03:03Z,111879,4530,52,0,348
16,Arduino Course for Beginners - Open-Source Electronics Platform,2021-06-08T13:12:14Z,119165,6289,67,0,294
17,OpenCV Python Course - Learn Computer Vision and AI,2021-06-07T20:27:27Z,48467,2249,15,0,98
18,How to Build a Hackintosh - Step-by-Step Guide (Install MacOS Big Sur on PC),2021-06-03T14:04:12Z,78670,3292,68,0,333
19,Python for Bioinformatics - Drug Discovery Using Machine Learning and Data Analysis,2021-06-02T13:17:40Z,80456,4064,24,0,186
20,Next.js for Beginners - Full Course,2021-06-01T13:57:06Z,74336,2927,63,0,173
21,Advanced Computer Vision with Python - Full Course,2021-05-27T13:50:46Z,201573,10937,71,0,245
22,"🎮 Easy JavaScript Game Development with Kaboom.js (Mario, Zelda, and Space Invaders) - Full Course",2021-05-26T14:12:22Z,128542,6012,86,0,324
23,Learn CSS Media Queries by Building 3 Projects - Full Course,2021-05-24T14:24:52Z,38377,1807,37,0,115
24,Learn Modern C++ by Building an Audio Plugin (w/ JUCE Framework) - Full Course,2021-05-20T13:48:45Z,193863,9999,37,0,415
25,Angular 11 Tutorial - Code a Project from Scratch,2021-05-18T16:04:15Z,71028,2307,53,0,288
26,Kivy Course - Create Python Games and Mobile Apps,2021-05-12T14:34:45Z,146259,6345,45,0,372
27,Typography for Developers - Full Course from Treehouse,2021-05-11T12:56:06Z,76216,3643,18,0,143
28,Chrome DevTools - Crash Course,2021-05-06T13:06:01Z,65920,2964,70,0,110
29,OpenCV Tutorial - Develop Computer Vision Apps in the Cloud With Python,2021-05-04T14:47:51Z,48280,2002,26,0,82
30,Azure Administrator Certification (AZ-104) - Full Course to PASS the Exam,2021-05-03T15:31:37Z,159783,5175,38,0,276
31,Learn Docker - DevOps with Node.js & Express,2021-04-29T13:32:07Z,80419,3368,18,0,169
32,MERN Stack Course - ALSO: Convert Backend to Serverless with MongoDB Realm,2021-04-28T14:05:10Z,103599,4072,31,0,242
33,OpenGL Course - Create 3D and 2D Graphics With C++,2021-04-27T14:12:12Z,149898,6242,70,0,332
34,Data Structures For Python Developers (w/ Flask) - Course,2021-04-22T13:20:37Z,62189,2474,16,0,118
35,UML Diagrams Full Course (Unified Modeling Language),2021-04-21T17:37:08Z,87074,3576,29,0,104
36,"Create an Instagram Clone with React, Tailwind CSS, Firebase - Tutorial",2021-04-19T15:07:49Z,105427,4893,34,0,333
37,"Django 3 Course - Python Web Framework (+ pandas, matplotlib, & more)",2021-04-16T14:32:05Z,101929,3975,30,0,184
38,Learn Unity - Beginner's Game Development Tutorial,2021-04-15T13:40:31Z,304949,12691,108,0,814
39,How To Make a Website With WordPress - 2021 (Beginners Tutorial),2021-04-13T14:01:19Z,86758,2737,47,0,151
40,Code a Snake Game with Python and Pygame 🐍 - Tutorial,2021-04-08T12:59:29Z,66223,1938,43,0,151
41,Scikit-learn Crash Course - Machine Learning Library for Python,2021-04-07T15:20:39Z,51674,1976,9,0,76
42,E-commerce Website With Django and Vue Tutorial (Django Rest Framework),2021-04-06T17:02:00Z,115859,3773,43,0,234
43,Web App Testing with WebdriverIO - Crash Course,2021-04-02T12:52:12Z,27652,887,14,0,54
44,Node.js and Express.js - Full Course,2021-04-01T12:37:58Z,299972,9924,82,0,482
45,Java Beginner Course - Get Started Coding with Java!,2021-03-25T13:21:04Z,54195,1965,36,0,153
46,Six Quick Python Projects,2021-03-24T13:30:53Z,82964,3028,58,0,146
47,Pixel Effects with JavaScript and HTML Canvas - Tutorial,2021-03-23T13:48:43Z,159774,6180,19,0,172
48,Algorithms and Data Structures - Full Course for Beginners from Treehouse,2021-03-18T19:48:53Z,476615,20896,87,0,633
49,"User Authentication in Web Apps (Passport.js, Node, Express)",2021-03-16T13:53:30Z,75739,3296,29,0,159
50,Learn TypeScript - Full Course for Beginners,2021-03-15T13:31:10Z,84108,3356,49,0,165
51,"Database Systems - Cornell University Course (SQL, NoSQL, Large-Scale Data Analysis)",2021-03-11T15:16:55Z,244555,9907,39,0,305
52,Flask Course - Python Web Application Development,2021-03-10T14:53:17Z,146589,4406,39,0,306
53,Linux Server Course - System Configuration and Operation,2021-03-09T16:56:13Z,201380,8301,48,0,205
54,Code a Discord Bot with JavaScript - Host for Free in the Cloud,2021-03-08T14:21:27Z,75323,2933,40,0,301
55,"Create a Twitter Clone with Vue.js, Quasar Framework & Firebase for iOS, Android, Mac & Windows",2021-03-05T15:28:34Z,41495,1813,11,0,130
56,AWS Basics for Beginners - Full Course,2021-03-04T13:59:03Z,354249,11193,60,0,355
57,Postman Beginner's Course - API Testing,2021-03-01T14:47:53Z,167650,5444,31,0,214
58,React and Golang JWT Authentication - Tutorial,2021-02-26T15:08:22Z,35665,1057,8,0,72
59,Create an Arkanoid Game with TypeScript - Tutorial,2021-02-25T14:17:40Z,22445,927,17,0,34
60,Serverless Functions Course - Create a Serverless API,2021-02-24T15:28:31Z,33286,1228,4,0,45
61,"Data Visualization with D3, JavaScript, React - Full Course [2021]",2021-02-22T16:05:59Z,109864,4576,21,0,225
62,"Data Analysis with Python Course - Numpy, Pandas, Data Visualization",2021-02-18T17:03:50Z,334191,12542,110,0,252
63,Build a Robinhood-Style Android App to Track COVID-19 Cases - Kotlin Tutorial,2021-02-16T19:09:46Z,34181,981,44,0,59
64,"UI / UX Design Tutorial – Wireframe, Mockup & Design in Figma",2021-02-10T14:40:38Z,222827,9096,70,0,219
65,Python Project - Ameritrade API Stock Screener,2021-02-09T15:00:45Z,52509,1799,33,0,91
66,Build Three Django Projects - Python Course,2021-02-05T16:49:31Z,84561,2708,56,0,149
67,freeCodeCamp.org Curriculum Expansion: Math + Machine Learning + Data Science,2021-02-02T19:00:57Z,76045,3290,14,0,193
68,Object Oriented Programming (OOP) in C++ Course,2021-02-02T16:48:25Z,339298,13163,141,0,690
69,Data Structures - Full Course Using C and C++,2021-01-27T14:07:37Z,437636,17922,139,0,497
70,Android Studio Tutorial - Build a GPS App,2021-01-26T14:56:42Z,50926,1689,19,0,98
71,Build a Shopping Cart with React and TypeScript - Tutorial,2021-01-21T14:26:24Z,84127,2834,30,0,151
72,Basics of SQL Injection - Penetration Testing for Ethical Hackers,2021-01-19T17:36:28Z,70271,2633,68,0,123
73,"How to Make a Landing Page using HTML, SCSS, and JavaScript - Full Course",2021-01-13T13:48:35Z,381988,15457,156,0,500
74,Java Testing - JUnit 5 Crash Course,2021-01-12T15:59:45Z,53901,1382,29,0,51
75,Build 12 Data Science Apps with Python and Streamlit - Full Course,2021-01-07T15:24:06Z,233369,9384,74,0,328
76,Build a Complete Android App with Firebase - Full Course with Kotlin,2021-01-05T15:47:56Z,48065,1625,27,0,64
77,Image Generation using GANs | Deep Learning with PyTorch: Zero to GANs | Part 6 of 6,2021-01-02T22:52:29Z,34583,1155,16,0,16
78,20 Award-Winning JavaScript Games – Js13kGames 2020 Winners,2020-12-31T13:34:53Z,41432,1245,26,0,88
79,Pointers in C / C++ [Full Course],2020-12-29T15:31:07Z,550129,19881,191,0,670
80,"Build an Instagram Clone with React Native, Firebase Firestore, Redux, Expo - Full Course",2020-12-22T14:25:50Z,209909,6665,94,0,503
81,"Python Microservices Web App (with React, Django, Flask) - Full Course",2020-12-21T14:44:14Z,206342,6982,60,0,253
82,"Data Augmentation, Regularization, and ResNets | Deep Learning with PyTorch: Zero to GANs | 5 of 6",2020-12-19T18:05:55Z,20792,546,8,0,8
83,How to Build a Career in Tech: Jordan Jackson Connects the Dots,2020-12-18T19:12:16Z,17125,538,20,0,27
84,Webhooks for Beginners - Full Course,2020-12-17T15:35:42Z,62680,2223,30,0,127
85,Java Android App using REST API - Network Data in Android Course,2020-12-16T16:48:47Z,64088,2114,22,0,96
86,Code a Discord Bot with Python - Host for Free in the Cloud,2020-12-15T16:04:05Z,488336,16955,232,0,2410
87,Image Classification with Convolutional Neural Networks | Deep Learning with PyTorch: Zero to GANs |,2020-12-12T18:35:21Z,37403,1191,13,0,16
88,How to Build a Career in Tech: April Speight Connects the Dots,2020-12-11T19:04:14Z,15047,436,14,0,14
89,Reactathon Conference Live Stream - Day Three,2020-12-09T23:22:56Z,21686,525,9,0,5
90,12 Beginner Python Projects - Coding Course,2020-12-09T16:03:12Z,821011,30856,390,0,916
91,Reactathon Conference Live Stream - Day Two,2020-12-08T22:46:02Z,18956,489,13,0,7
92,"Python Main Function, Door Game, and More - Python Basics with Sam",2020-12-08T16:19:18Z,19763,678,13,0,13
93,Reactathon Conference Live Stream - Day One,2020-12-07T23:00:38Z,38458,1181,21,0,18
94,SAP UI5 / Fiori - Full Course,2020-12-07T14:32:46Z,29847,836,9,0,53
95,Training Deep Neural Networks on a GPU | Deep Learning with PyTorch: Zero to GANs | Part 3 of 6,2020-12-05T17:35:32Z,31759,930,12,0,18
96,How to Build a Career in Tech: Tara Z. Manicsic Connects the Dots,2020-12-04T19:17:45Z,15460,534,19,0,15
97,Algorithmic Trading Using Python - Full Course,2020-12-04T17:26:37Z,753494,25259,228,0,1429
98,Dynamic Programming - Learn to Solve Algorithmic Problems & Coding Challenges,2020-12-03T14:50:22Z,988390,38757,198,0,1838
99,Build and Publish an Android App - Full Course with Kotlin,2020-12-01T15:31:54Z,108159,4263,36,0,214
100,How to Find Freelance Jobs,2020-11-30T18:30:37Z,53249,2375,42,0,105
101,PyTorch Images and Logistic Regression | Deep Learning with PyTorch: Zero to GANs | Part 2 of 6,2020-11-28T23:54:36Z,34502,937,20,0,24
102,How to Build a Career in Tech: Kurt Kemple Connects the Dots,2020-11-27T19:06:40Z,17799,662,14,0,29
103,Redis Course - In-Memory Database Tutorial,2020-11-25T17:18:26Z,44140,1154,61,0,60
104,How to Undo Mistakes With Git Using the Command Line,2020-11-24T15:30:14Z,41533,1540,15,0,65
105,PyTorch Basics and Gradient Descent | Deep Learning with PyTorch: Zero to GANs | Part 1 of 6,2020-11-21T17:25:06Z,73710,1689,16,0,49
106,How to Build a Career in Tech: Cassidy Williams (@cassidoo) Connects the Dots,2020-11-20T19:02:35Z,27710,1147,34,0,47
107,Linear Algebra - Full College Course,2020-11-19T14:13:56Z,372652,13240,84,0,510
108,Web Scraping with Python - Beautiful Soup Crash Course,2020-11-18T16:05:43Z,245413,7853,95,0,381
109,Solving Python Challenges - Python Basics with Sam,2020-11-17T16:09:28Z,31203,987,18,0,18
110,ASP.NET Core Crash Course - C# App in One Hour,2020-11-16T15:21:14Z,244292,6022,55,0,369
111,How to Build a Career in Tech: Henri Helvetica Connects the Dots,2020-11-13T19:06:54Z,20053,603,23,0,22
112,"Web App Tutorial - JavaScript, Mobile First, Accessibility, Persistent Data, Sass",2020-11-12T15:30:08Z,45748,1655,19,0,126
113,"How to Put a Website Online: Template, Coding, Domain, Hosting, and DNS",2020-11-11T16:42:47Z,305433,13586,144,0,407
114,Learn Ruby on Rails - Full Course,2020-11-09T14:50:57Z,180333,4389,74,0,405
115,Visual Studio Code Full Course - VS Code for Beginners,2020-11-04T16:03:31Z,108342,4430,100,0,194
116,Random Password Generator - Python Basics with Sam,2020-11-03T16:04:31Z,30398,1119,20,0,26
117,OpenCV Course - Full Tutorial with Python,2020-11-03T14:18:52Z,999365,14050,237,0,533
118,Microsoft Excel Tutorial for Beginners - Full Course,2020-10-28T13:09:30Z,620833,17270,177,0,512
119,Code 15 React Projects - Complete Course,2020-10-27T13:34:16Z,400157,12724,94,0,434
120,Use PHP to Create an MVC Framework - Full Course,2020-10-22T18:03:09Z,92909,3166,43,0,211
121,Docker and Kubernetes - Full Course for Beginners,2020-10-22T13:46:16Z,105569,4006,86,0,241
122,Practical Deep Learning for Coders - Full Course from fast.ai and Jeremy Howard,2020-10-21T13:01:15Z,184619,7445,55,0,156
123,Tkinter Calculator - Python Basics with Sam,2020-10-20T15:46:56Z,23529,806,10,0,27
124,Flutter App with Firebase Authentication and Firestore Tutorial - Crypto Wallet,2020-10-19T13:48:42Z,52704,1665,31,0,99
125,Reviewing Your Website Designs Live - with Gary Simon,2020-10-14T16:17:15Z,19160,578,13,0,20
126,React / GraphQL Course - Build a social media app (MERNG Stack),2020-10-14T15:51:40Z,279936,9381,63,0,749
127,SQLite Database for Android - Full Course,2020-10-13T17:15:04Z,45075,1432,13,0,79
128,Data Science Hands-On Crash Course,2020-10-08T13:52:08Z,58227,2197,30,0,65
129,Complete Guide to Open Source - How to Contribute,2020-10-07T17:04:10Z,101601,5140,48,0,330
130,Reviewing Your Website Designs Live - with Gary Simon,2020-10-07T15:41:52Z,21073,723,16,0,15
131,Chicken Nuggets and itertools - Python Basics with Sam,2020-10-06T16:40:13Z,15542,539,13,0,7
132,"Full React Course 2020 - Learn Fundamentals, Hooks, Context API, React Router, Custom Hooks",2020-10-06T14:16:07Z,919291,23996,198,0,1260
133,Build a Website from Start to Finish using WordPress [Full Course],2020-10-01T14:53:39Z,185599,5601,134,0,284
134,Reviewing Your Website Designs Live - with Gary Simon,2020-09-30T16:27:28Z,27899,949,25,0,55
135,Intro to Object Oriented Programming - Crash Course,2020-09-30T13:37:04Z,267480,9753,111,0,373
136,JavaScript Tutorial: Build Flappy Bird and Doodle Jump,2020-09-28T13:21:57Z,94773,4258,53,0,153
137,Visual Studio Code Crash Course,2020-09-23T15:18:53Z,379332,12003,137,0,395
138,"Board Game, Lists and More - Python Basics with Sam",2020-09-22T15:59:15Z,22775,750,12,0,16
139,Flutter Tutorial - Building a Production App From Scratch,2020-09-22T13:07:05Z,105257,3225,63,0,159
140,UI Design Tutorial - Website From Wireframe,2020-09-21T18:06:15Z,70801,2667,30,0,83
141,Data Analysis with Python: Part 6 of 6 - Exploratory Data Analysis - A Case Study [Live Course],2020-09-19T19:27:54Z,51614,1206,25,0,32
142,Computer Networking Course - Network Engineering [CompTIA Network+ Exam Prep],2020-09-17T14:08:59Z,605125,22239,220,0,653
143,Calculus 2 - Full College Course,2020-09-15T13:11:41Z,157354,4879,39,0,239
144,Data Analysis with Python: Part 5 of 6 - Visualization with Matplotlib and Seaborn (Live Course),2020-09-12T18:40:18Z,49292,1171,14,0,38
145,Blazor Course - Use ASP.NET Core to Build Full-Stack C# Web Apps,2020-09-11T13:18:01Z,169648,3250,80,0,187
146,Unreal Engine Tutorial - Create a 2D Snake Game [Code + Assets],2020-09-09T16:38:33Z,34961,1265,34,0,95
147,Data Structures - Computer Science Course for Beginners,2020-09-08T13:07:50Z,445772,13539,124,0,474
148,Data Analysis with Python: Part 4 of 6 - Analyzing tabular data with Pandas,2020-09-05T19:39:40Z,50561,1157,32,0,41
149,How to Design a Website – A UX Wireframe Tutorial,2020-09-03T16:29:24Z,139311,5885,62,0,205
150,AWS SysOps Administrator Associate 2020 (PASS THE EXAM!),2020-09-01T15:26:42Z,101486,2956,27,0,137
151,Generators and Classes - Python Basics with Sam,2020-09-01T15:24:44Z,19229,665,11,0,20
152,Data Analysis with Python: Part 3 of 6 Numerical Computing with Numpy (Live Course),2020-08-29T21:14:25Z,66304,1449,25,0,43
153,Intermediate Python Programming Course,2020-08-27T17:23:03Z,895519,26420,196,0,1127
154,Calculus 1 - Full College Course,2020-08-25T15:30:08Z,1638190,64773,660,0,2796
155,Build a Shopping List for the Command Line - Python Basics with Sam,2020-08-25T15:14:35Z,21409,660,15,0,23
156,Data Analysis with Python: Part 2 of 6 - Python Functions and Working with Files (Live Course),2020-08-22T18:58:38Z,85620,1799,35,0,56
157,Unit Testing in Vue.js - with Gwen Faraday,2020-08-21T16:18:56Z,25075,594,33,0,17
158,ASP.NET Core MVC Course (.NET 5),2020-08-20T14:51:59Z,205464,4448,97,0,225
159,Python Project Tutorial - Your First Python Project,2020-08-19T14:32:32Z,130284,4420,60,0,178
160,Scope and Decorators - Python Basics with Sam,2020-08-18T16:58:05Z,17969,586,13,0,10
161,Data Analysis with Python: Part 1 of 6 (Live Course),2020-08-15T17:07:31Z,242164,5619,89,0,158
162,"PERN Stack Course - Build a Yelp clone (Postgres, Express, React, Node.js)",2020-08-14T13:29:01Z,86642,2563,20,0,240
163,COBOL Course - Programming with VSCode,2020-08-11T19:08:01Z,51387,1643,48,0,224
164,Command Line and Recursion in Python - Python Basics with Sam,2020-08-11T15:47:36Z,21412,601,21,0,22
165,"Network Programming with Python Course (build a port scanner, mailing client, chat room, DDOS)",2020-08-07T18:59:49Z,157853,5177,52,0,200
166,Precalculus Course,2020-08-04T14:30:02Z,392965,13147,106,0,707
167,Live Coding Project: Create an Hour Tracking App using Vue.js (Part 2) - with Gwen Faraday,2020-07-31T16:08:51Z,28737,536,24,0,36
168,Deep Learning Crash Course for Beginners,2020-07-30T13:30:02Z,127232,4000,66,0,124
169,Find Longest Substring / Guessing Game - Python Basics with Sam,2020-07-28T16:16:34Z,26933,711,25,0,24
170,"Build an Online Store Using AWS, React, and Stripe",2020-07-27T16:45:31Z,85869,2771,62,0,117
171,Live Coding Project: Create an Hour Tracking App using Vue.js - with Gwen Faraday,2020-07-24T16:21:56Z,32399,795,20,0,30
172,College Algebra - Full Course,2020-07-24T04:38:45Z,1114973,38967,494,0,2078
173,"Prime Numbers, Times Tables, & More - Python Basics with Sam",2020-07-21T16:10:45Z,26499,637,15,0,36
174,Live Coding Project: Create a Pomodoro Clock using Vue.js - with Gwen Faraday,2020-07-17T16:22:07Z,25848,657,23,0,28
175,Terraform Course - Automate your AWS cloud infrastructure,2020-07-16T14:32:30Z,387085,7925,81,0,423
176,Spring Boot Java Tutorial - REST API using PostgreSQL and JWT,2020-07-15T15:11:05Z,82699,1647,70,0,92
177,"Python For Loops, Functions, and Random - Python Basics with Sam",2020-07-14T16:16:25Z,45379,1308,31,0,37
178,Live Coding Project: Create a Calculator using Vue.js - with Gwen Faraday,2020-07-10T16:25:45Z,27143,780,23,0,19
179,React / Typescript Tutorial - Build a Quiz App,2020-07-09T14:14:13Z,159107,3943,89,0,257
180,Create A 2.5D Platformer Game With Unreal Engine (Tutorial),2020-07-07T17:18:11Z,80832,1913,32,0,99
181,Intro to Python Livestream - Python Basics with Sam,2020-07-07T16:21:45Z,136783,3239,56,0,115
182,Live Coding Project: Create a Drum Machine using Vue.js - with Gwen Faraday,2020-07-03T16:04:32Z,33298,887,26,0,25
183,Build a Java Desktop Application - Full Course (Sudoku),2020-07-02T14:55:23Z,97477,2305,83,0,134
184,Deno Course - Better than Node.js?,2020-06-30T14:19:57Z,65427,2247,26,0,168
185,Deep Learning with PyTorch Live Course - GANs for Image Generation (Part 6 of 6),2020-06-27T17:55:53Z,33919,762,23,0,24
186,Live Coding Project: Create a Markdown Previewer using Vue.js - with Gwen Faraday,2020-06-26T15:26:57Z,21708,503,35,0,51
187,Strapi & GatsbyJS Course - Portfolio Project,2020-06-25T15:43:26Z,40861,1123,16,0,51
188,Scikit-Learn Course - Machine Learning in Python Tutorial,2020-06-23T15:56:49Z,169271,3750,133,0,135
189,"Deep Learning with PyTorch Live Course - ResNet, Regularization and Data Augmentation (Part 5 of 6)",2020-06-20T18:18:42Z,29098,647,18,0,29
190,Live Coding Project: Create a Random Quote Machine using Vue.js - with Gwen Faraday,2020-06-19T17:24:13Z,32320,710,26,0,28
191,Keras with TensorFlow Course - Python Deep Learning and Neural Networks for Beginners Tutorial,2020-06-18T14:50:04Z,360129,9945,135,0,413
192,Microsoft Azure Fundamentals Certification Course (AZ-900) - Pass the exam in 3 hours!,2020-06-17T18:56:48Z,1517836,22727,320,0,1158
193,"Project Euler Challenges 24, 28, 29 - Coding Challenges with Florin",2020-06-17T16:49:44Z,13891,275,10,0,11
194,"Flutter Essentials - Learn to make apps for Android, iOS, Windows, Mac, Linux (Full Course)",2020-06-16T17:10:58Z,72643,1987,41,0,176
195,Deep Learning with PyTorch Live Course - Image Classification with CNNs (Part 4 of 6),2020-06-13T17:44:16Z,33831,791,14,0,26
196,DevOps Prerequisites Course - Getting started with DevOps,2020-06-12T14:03:46Z,144600,3532,32,0,97
197,Project Euler Challenges 23-25 - Coding Challenges with Florin,2020-06-10T17:43:25Z,15966,366,10,0,19
198,Build 15 JavaScript Projects - Vanilla JavaScript Course,2020-06-09T16:21:02Z,747086,22860,201,0,651
199,Deep Learning with PyTorch Live Course - Training Deep Neural Networks on GPUs (Part 3 of 6),2020-06-06T17:25:38Z,33255,841,17,0,33
200,Learn React Native Gestures and Animations - Tutorial,2020-06-05T14:39:23Z,53105,1520,18,0,87
201,License To Pentest: Ethical Hacking Course For Beginners,2020-06-04T15:00:11Z,136064,5342,90,0,593
202,Project Euler Challenges 18-22 - Coding Challenges with Florin,2020-06-03T17:27:54Z,16811,342,17,0,21
203,"Python for Data Science - Course for Beginners (Learn Python, Pandas, NumPy, Matplotlib)",2020-06-02T14:05:17Z,947711,27679,288,0,733
204,Deep Learning with PyTorch Live Course - Working with Images & Logistic Regression (Part 2 of 6),2020-05-30T18:33:03Z,50056,1322,26,0,64
205,Git and GitHub for Beginners - Crash Course,2020-05-28T14:58:15Z,812107,25930,373,0,1183
206,Project Euler Challenges 13-17 - Coding Challenges with Florin,2020-05-27T17:55:07Z,19384,503,20,0,15
207,Android Development for Beginners - Full Course,2020-05-26T16:06:03Z,1331561,33048,338,0,1552
208,"Deep Learning with PyTorch Live Course - Tensors, Gradient Descent & Linear Regression (Part 1 of 6)",2020-05-23T18:02:44Z,129222,4484,53,0,139
209,Web Application Ethical Hacking - Penetration Testing Course for Beginners,2020-05-21T15:35:13Z,146537,4620,57,0,142
210,Spring Boot and Angular Tutorial - Build a Reddit Clone (Coding Project),2020-05-19T16:11:17Z,203964,4863,71,0,399
211,Code Tetris: JavaScript Tutorial for Beginners,2020-05-14T15:43:19Z,192988,5168,132,0,630
212,Project Euler Challenges 5–12 - Coding Challenges with Florin,2020-05-13T17:57:44Z,22217,536,16,0,13
213,SQLite Databases With Python - Full Course,2020-05-12T16:09:03Z,203491,6044,68,0,312
214,Matplotlib Crash Course,2020-05-07T15:25:58Z,57940,1871,15,0,80
215,Learn the Svelte JavaScript Framework - Full Course,2020-05-05T13:30:08Z,46971,1200,18,0,125
216,Project Euler Challenges 1–4 - Coding Challenges with Florin,2020-05-03T14:00:14Z,34224,730,21,0,80
217,The Oracle Foundations Associate Cloud Certification (PASS THE EXAM) – Full Course,2020-05-02T11:06:18Z,121912,2549,39,0,285
218,May 2020 Summit - freeCodeCamp.org,2020-05-01T17:12:09Z,51304,1710,15,0,31
219,PyTorch for Deep Learning - Full Course / Tutorial,2020-04-30T13:30:00Z,359782,9305,133,0,320
220,Yii2 PHP Framework - Full Course (Build a YouTube Clone),2020-04-28T13:41:09Z,79847,2006,27,0,201
221,Build a Brain Computer App with React Native (Part 8) - Live Coding with Jesse,2020-04-26T19:55:29Z,29327,678,10,0,13
222,How to Create a Custom WordPress Theme - Full Course,2020-04-23T14:07:25Z,285653,6632,112,0,379
223,Introduction to Programming and Computer Science - Full Course,2020-04-21T13:45:02Z,1584810,47687,458,0,1608
224,Build a Brain Computer App with React Native (Part 7) - Live Coding with Jesse,2020-04-20T00:37:11Z,20604,405,5,0,7
225,"Data Analysis with Python - Full Course for Beginners (Numpy, Pandas, Matplotlib, Seaborn)",2020-04-15T13:19:55Z,867763,21429,227,0,534
226,#LockdownConf – How Developers are Adapting to the Coronavirus – All 4 Conference Panels,2020-04-14T18:57:08Z,53998,1864,50,0,32
227,Learn JavaScript by Building 7 Games - Full Course,2020-04-08T16:12:47Z,422795,13757,368,0,934
228,AWS Certified Developer - Associate 2020 (PASS THE EXAM!),2020-04-03T14:29:29Z,387021,8861,63,0,551
229,Build a Brain Computer App with React Native (Part 6) - Live Coding with Jesse,2020-03-28T20:53:01Z,38940,444,14,0,17
230,Build a Brain Computer App with React Native (Part 5) - Live Coding with Jesse,2020-03-21T19:39:13Z,21457,402,9,0,12
231,Build a Brain Computer App with React Native (Part 4) - Live Coding with Jesse,2020-03-19T22:38:26Z,16064,318,10,0,8
232,"PERN Stack Course - Postgres, Express, React, and Node",2020-03-19T14:23:10Z,153233,3613,35,0,269
233,Build a Brain Computer App with React Native (Part 3) - Live Coding with Jesse,2020-03-15T23:47:32Z,20379,475,17,0,40
234,"JAMstack Course - Build websites that are simpler, faster, and more secure",2020-03-10T17:15:43Z,83602,2204,24,0,134
235,TensorFlow 2.0 Complete Course - Python Neural Networks for Beginners Tutorial,2020-03-03T15:44:00Z,1272609,33661,397,0,1278
236,Functional Programming in Java - Full Course,2020-02-24T16:45:24Z,86280,2395,34,0,60
237,Build and deploy a portfolio website [Full Tutorial Course],2020-02-18T16:17:07Z,361885,9822,118,0,309
238,Build a Brain Computer App with React Native - Live Coding with Jesse,2020-02-16T23:35:45Z,44343,906,25,0,28
239,Learn ASP.NET Core 3.1 - Full Course for Beginners [Tutorial],2020-02-05T16:10:15Z,843218,11678,331,0,595
240,Natural Language Processing with TensorFlow 2 - Beginner's Course,2020-01-29T15:31:22Z,59651,1825,49,0,69
241,AWS for Startups - Deploying with AWS Tutorial,2020-01-21T17:51:47Z,70224,1921,19,0,65
242,Ultimate Freelancing Guide for Web Developers (Make money through freelance programming!),2020-01-15T16:55:47Z,134255,5301,48,0,177
243,New Year's Eve Live Coding with Jesse!,2020-01-01T05:49:25Z,38556,819,23,0,41
