,title,publication_date,viewCount,likeCount,dislikeCount,favoriteCount,commentCount
774,"Working with NextJS, GraphQL and MaterialUI Part 2 (P5D21) - Live Coding with Jesse",2018-01-11T21:26:52Z,1809,37,0,0,4
775,"Working with NextJS, GraphQL and MaterialUI (P5D20) - Live Coding with Jesse",2018-01-10T20:31:16Z,3471,46,4,0,2
776,Writing GraphQL Queries (P5D19) - Live Coding with Jesse,2018-01-09T19:33:54Z,2493,49,3,0,1
777,How I Built A Personal Brand Chatbot,2018-01-08T20:37:19Z,3644,59,43,0,5
778,Creating a Material Design Style Homepage Part 3 (P5D18) - Live Coding with Jesse,2018-01-05T20:39:50Z,2181,29,1,0,0
779,Creating a Material Design Style Homepage Part 2 (P5D17) - Live Coding with Jesse,2018-01-04T20:00:36Z,2007,41,4,0,0
780,Creating a Material Design Style Homepage (P5D16) - Live Coding with Jesse,2018-01-03T21:36:00Z,4054,85,1,0,0
781,Contributing to FreeCodeCamp - Writing ES6 Challenge Tests,2017-12-22T21:55:12Z,3373,50,2,0,2
782,Updating an Old React / NextJS Site (P1D42) - Live Coding with Jesse,2017-12-21T20:10:14Z,1850,34,1,0,2
783,Styling HTML with CSS Part 2 (P5D15) - Live Coding with Jesse,2017-12-20T22:50:27Z,2539,61,2,0,0
784,Styling HTML with CSS  (P5D14) - Live Coding with Jesse,2017-12-19T20:55:18Z,6211,96,8,0,7
785,Contributing to FreeCodeCamp - Writing ES6 Challenge Tests,2017-12-18T23:01:20Z,2790,63,1,0,4
786,Populating NextJS Pages with WordPress Data via GraphQL Part 2 (P5D13) - Live Coding with Jesse,2017-12-15T20:53:44Z,1808,37,3,0,2
787,Populating NextJS Pages with WordPress Data via GraphQL (P5D12) - Live Coding with Jesse,2017-12-14T18:07:21Z,4037,51,4,0,4
788,"Bash Tutorial: How to Use the Command Line in Linux, Windows, and Mac Terminal",2017-12-13T17:30:00Z,38458,1003,19,0,41
789,SQL Server to MySQL via WordPressAPI and NodeJS (P5D11) - Live Coding with Jesse,2017-12-12T21:02:33Z,2930,63,0,0,2
790,Setting Up KeystoneJS (P5D10) - Live Coding with Jesse,2017-12-11T20:17:46Z,6346,58,8,0,8
791,Data Migration with NodeJS (P5D9) - Live Coding with Jesse,2017-12-07T20:11:14Z,3380,31,1,0,4
792,Accessing a DB with Microsoft SQL Operations Studio (P5D8) - Live Coding with Jesse,2017-12-06T22:20:25Z,3196,32,2,0,3
793,Build a Node.js API - tutorial,2017-12-05T17:00:20Z,140852,2022,59,0,130
794,Setting Up an Electron Project (P6D1) - Live Coding with Jesse,2017-12-04T20:34:39Z,3246,57,3,0,7
795,How I built and launched a chatbot over the weekend,2017-12-04T18:59:12Z,9314,165,23,0,13
796,Nodevember Recap and Project Updates (P5D7) - Live Coding with Jesse,2017-11-30T21:33:18Z,1676,38,0,0,3
797,How I scaled the world’s largest music studio marketplace (part 2 of the Studiotime story),2017-11-29T17:38:35Z,5484,114,3,0,33
798,How I built the Airbnb of music studios in an evening (part 1 of the Studiotime story),2017-11-25T17:13:08Z,12705,346,5,0,68
799,NextJS Custom Server and Routing (P5D6) - Live Coding with Jesse,2017-11-22T20:53:55Z,3971,59,5,0,1
800,#freeCodeConf Greater Toronto Area 2017,2017-11-18T23:22:38Z,7094,189,3,0,11
801,Creating a Footer with MaterialUI (P5D5) - Live Coding with Jesse,2017-11-15T21:33:50Z,7797,60,10,0,4
802,Building a Material Design Drawer with MaterialUI (P5D4) - Live Coding with Jesse,2017-11-14T21:14:11Z,6074,56,5,0,2
803,Customizing a MaterialUI App Bar (P5D3) - Live Coding with Jesse,2017-11-13T20:35:00Z,10023,79,17,0,3
804,Todo List Tutorial - Angular 4 and Redux,2017-11-13T18:10:54Z,7935,68,11,0,11
805,Getting Started with GatsbyJS (P5D2) - Live Coding with Jesse,2017-11-09T21:09:39Z,8278,119,9,0,9
806,Planning a New React Project (P5D1) - Live Coding with Jesse,2017-11-08T20:49:40Z,14761,198,5,0,13
807,React UI Updates (P4D16) - Live Coding with Jesse,2017-11-06T20:26:09Z,10048,53,5,0,1
808,"Material Design Font Sizes, Weights, and Colors (P4D15) - Live Coding with Jesse",2017-11-03T21:12:25Z,3052,45,1,0,2
809,Merging Pull Requests with Git and Github (P4D14) - Live Coding with Jesse,2017-11-02T21:36:06Z,2323,39,1,0,1
810,How to ace the whiteboard coding interview,2017-10-31T15:18:02Z,36895,745,25,0,66
811,Editing Salesforce Visualforce Pages (Part 4) - Live Coding with Jesse,2017-10-30T19:31:47Z,1194,21,1,0,2
812,Editing Salesforce Visualforce Pages (Part 3) - Live Coding with Jesse,2017-10-27T20:14:57Z,1278,18,2,0,0
813,Editing Salesforce Visualforce Pages (Part 2) - Live Coding with Jesse,2017-10-26T20:27:43Z,1342,22,1,0,0
814,Editing Salesforce Visualforce Pages - Live Coding with Jesse,2017-10-25T21:20:44Z,3812,57,4,0,0
815,Angular 4 Project Setup with Webpack,2017-10-25T16:37:28Z,13615,132,16,0,20
816,Troubleshooting NodeJS Auth (P4D13) - Live Coding with Jesse,2017-10-24T21:33:17Z,1634,26,0,0,1
817,Using Redux with React Native - Live Coding with Jesse,2017-10-23T19:01:57Z,4890,56,4,0,8
818,NodeJS User Auth with PassportJS (P4D12) - Live Coding with Jesse,2017-10-20T20:36:36Z,5033,54,6,0,12
819,React Project UI Updates (P4D11) - Live Coding with Jesse,2017-10-19T19:58:55Z,1768,32,1,0,0
820,Setting Up a Kanban Board (P4D10) - Live Coding with Jesse,2017-10-18T19:48:47Z,6818,61,6,0,1
821,Creating a Grid Layout with MaterialUI (P4D9) - Live Coding with Jesse,2017-10-13T20:18:56Z,10110,57,17,0,1
822,Merging GitHub Pull Requests (P4D8) - Live Coding with Jesse,2017-10-12T20:04:25Z,2251,49,0,0,0
823,Using WPGraphQL with React (P4D7) - Live Coding with Jesse,2017-10-11T20:45:39Z,1581,25,0,0,2
824,Google Interview Question: How to Code a Queue Using a Stack. Whiteboard Wednesday by Irfan Baqui,2017-10-11T18:34:18Z,6689,199,2,0,15
825,Live Workshop: Basics of JavaScript & ES6 Syntax,2017-10-10T22:45:27Z,10956,296,5,0,20
826,Styling React with MaterialUI Part 2 (P4D6) - Live Coding with Jesse,2017-10-10T20:44:24Z,2458,41,0,0,3
827,Styling React with MaterialUI (P4D5) - Live Coding with Jesse,2017-10-09T19:03:21Z,5248,58,4,0,3
828,How to make money as a freelance developer - business tips from an expert,2017-10-09T00:15:24Z,55151,2016,15,0,76
829,Using Apollo with React (P4D4) - Live Coding with Jesse,2017-10-08T01:29:40Z,2838,34,2,0,1
830,GraphQL + WordPress (P4D3) - Live Coding with Jesse,2017-10-05T19:51:15Z,4737,71,3,0,1
831,Structuring Redux Store (P4D2) - Live Coding with Jesse,2017-10-04T19:57:16Z,4220,61,5,0,1
832,React 16 Setup with Create React App (P4D1) - Live Coding with Jesse,2017-10-03T20:38:30Z,8602,110,7,0,21
833,React: Material Design Tabs (P2D34) - Live Coding with Jesse,2017-09-29T18:49:05Z,4877,53,3,0,6
834,How to ship code faster using continuous integration and delivery,2017-09-28T17:22:57Z,15381,251,12,0,10
835,React Project Tutorial - Game of Life,2017-09-27T16:02:18Z,59482,811,22,0,86
836,Live Workshop: Basics of ReactJS,2017-09-26T22:29:37Z,19132,340,11,0,19
837,Redesigning a Homepage Part 2 (P3D9) - Live Coding with Jesse,2017-09-26T16:29:24Z,1735,36,1,0,0
838,Redesigning a Homepage (P3D8) - Live Coding with Jesse,2017-09-22T20:04:55Z,2920,46,1,0,3
839,JAMstack Tutorial - Full site using Netlify & Hugo,2017-09-22T16:47:42Z,43925,871,25,0,53
840,SendGrid API Node Client: Breaking Changes  (P2D33) - Live Coding with Jesse,2017-09-21T20:18:33Z,2263,31,1,0,1
841,Which programming language should you learn first?,2017-09-21T16:58:41Z,72939,1279,37,0,137
842,Creating a Footer Part 2  (P3D7) - Live Coding with Jesse,2017-09-20T19:49:35Z,1629,24,3,0,0
843,Creating a Footer (P3D6) - Live Coding with Jesse,2017-09-19T20:03:15Z,2253,44,0,0,0
844,Alexa Development 101 - Full Amazon Echo tutorial course in one video!,2017-09-19T16:58:33Z,108139,1389,21,0,102
845,Parallax Hero Section (P3D5) - Live Coding with Jesse,2017-09-18T18:54:30Z,2251,36,2,0,1
846,Easily code a virtual reality web experience with A-Frame (WebVR),2017-09-16T15:28:17Z,36753,830,11,0,49
847,Adding a Material Design Side Nav with .NET Part 2 (P3D4) - Live Coding with Jesse,2017-09-15T19:59:05Z,1638,18,1,0,0
848,Adding a Material Design Side Nav with .NET (P3D3) - Live Coding with Jesse,2017-09-14T20:13:42Z,1759,28,1,0,0
849,Building a Nav with .NET (P3D2) - Live Coding with Jesse,2017-09-13T18:59:41Z,2642,46,2,0,0
850,Updating a Slow Website (P3D1) - Live Coding with Jesse,2017-09-12T19:47:20Z,2857,65,2,0,3
851,Sass Styling and Refactoring  (P2D32) - Live Coding with Jesse,2017-09-11T19:15:55Z,3633,50,5,0,1
852,Full Stack Web App using Vue.js & Express.js: Part 7 - Wrapping Up,2017-09-11T04:32:37Z,31840,453,1,0,159
853,Full Stack Web App using Vue.js & Express.js: Part 6 - Search,2017-09-11T03:45:08Z,25077,227,2,0,60
854,Full Stack Web App using Vue.js & Express.js: Part 5 - View Song,2017-09-09T19:46:46Z,25933,271,6,0,44
855,JavaScript Tic Tac Toe Project Tutorial  - Unbeatable AI w/ Minimax Algorithm,2017-09-09T15:10:28Z,200085,2873,88,0,317
856,Full Stack Web App using Vue.js & Express.js: Part 4,2017-09-08T03:56:40Z,52033,448,5,0,57
857,Full Stack Web App Using Vue.js & Express.js: Part 3 - Login,2017-09-08T01:06:33Z,76111,669,15,0,240
858,Browser Testing React Project  (P2D31) - Live Coding with Jesse,2017-09-07T20:43:19Z,2268,24,2,0,4
859,Styling React Components  (P2D30) - Live Coding with Jesse,2017-09-06T19:43:51Z,3528,53,2,0,2
860,Full Stack Web App using Vue.js & Express.js: Part 2 - Sequelize,2017-09-06T03:27:27Z,90343,985,26,0,311
861,Client Side React Form Validation  (P2D29) - Live Coding with Jesse,2017-09-05T20:20:16Z,3904,49,6,0,4
862,Full Stack Web App using Vue.js & Express.js: Part 1 - Intro,2017-09-03T04:50:41Z,316224,4587,76,0,438
863,Emailing Form Data with React and NodeJS (P2D28) - Live Coding with Jesse,2017-09-01T18:54:57Z,8251,81,3,0,10
864,React Project 2 Day 27 - Live Coding with Jesse,2017-08-31T19:18:18Z,2781,24,2,0,0
865,React Project 2 Day 26 - Live Coding with Jesse,2017-08-30T15:30:16Z,1876,28,0,0,3
866,React Project 2 Day 25 - Live Coding with Jesse,2017-08-29T20:04:46Z,1832,32,2,0,0
867,React Project 2 Day 24 - Live Coding with Jesse,2017-08-28T19:40:37Z,2063,38,4,0,0
868,React Project 2 Day 23 - Live Coding with Jesse,2017-08-25T19:09:05Z,2340,30,0,0,4
869,Recursion in software development,2017-08-22T16:44:19Z,52579,976,15,0,48
870,React Project 2 Day 22 - Live Coding with Jesse,2017-08-21T18:19:39Z,1566,12,0,0,3
871,jQuery vs vanilla JavaScript - Beau teaches JavaScript,2017-08-21T16:37:56Z,38541,789,10,0,44
872,React Project 2 Day 21 - Live Coding with Jesse,2017-08-18T20:03:37Z,2270,27,0,0,1
873,React Project 2 Day 20 - Live Coding with Jesse,2017-08-17T20:31:55Z,1847,33,1,0,0
874,I've done programming tutorials. Now what? - Ask Preethi,2017-08-17T13:18:52Z,64358,1499,50,0,105
875,What is Continuous Integration?,2017-08-17T01:13:25Z,42828,496,12,0,10
876,React Project 2 Day 19 - Live Coding with Jesse,2017-08-16T19:45:26Z,1792,30,0,0,2
877,jQuery: AJAX - Beau teaches JavaScript,2017-08-15T17:16:18Z,9983,163,4,0,2
878,React Project 2 Day 18 - Live Coding with Jesse,2017-08-14T19:48:32Z,1860,28,2,0,2
879,React Project 2 Day 17 - Live Coding with Jesse,2017-08-11T18:35:51Z,1908,23,1,0,1
880,React Project 2 Day 16 - Live Coding with Jesse,2017-08-10T20:37:56Z,1584,17,1,0,3
881,React Project 2 Day 15 - Live Coding with Jesse,2017-08-09T21:10:39Z,1800,26,1,0,1
882,Color Maze - The Daily Programmer #325,2017-08-08T22:11:43Z,2346,40,2,0,13
883,React Project 2 Day 14 - Live Coding with Jesse,2017-08-08T20:28:24Z,1625,27,0,0,3
884,jQuery: Dom Traversal (find parent and child nodes) - Beau teaches JavaScript,2017-08-08T17:35:46Z,14557,330,0,0,12
885,React Project 2 Day 13 - Live Coding with Jesse,2017-08-07T19:03:28Z,2126,31,0,0,6
886,React Project 2 Day 12 - Live Coding with Jesse,2017-08-04T18:40:42Z,2239,21,2,0,5
887,Handling Form Data and Uploads with React (P2D11) - Live Coding with Jesse,2017-08-03T20:46:35Z,3747,38,1,0,2
888,React Project 2 Day 10 - Live Coding with Jesse,2017-08-02T20:48:20Z,2472,24,2,0,2
889,Talking Clock - The Daily Programmer #321,2017-08-02T00:15:25Z,14146,316,5,0,30
890,React Project 2 Day 9 - Live Coding with Jesse,2017-08-01T20:24:23Z,2397,30,3,0,5
891,Spiral Ascension - The Daily Programmer #320,2017-07-31T21:14:28Z,2700,67,0,0,11
892,React Project 2 Day 8 - Live Coding with Jesse,2017-07-31T17:46:03Z,2633,34,2,0,1
893,jQuery: CSS and classes,2017-07-31T17:32:13Z,6363,86,2,0,4
894,React Project 2 Day 7 - Live Coding with Jesse,2017-07-28T15:22:23Z,2961,46,1,0,1
895,React Project 2 Day 6 - Live Coding with Jesse,2017-07-27T19:46:19Z,2557,31,0,0,4
896,jQuery: add and remove DOM elements - Beau teaches JavaScript,2017-07-27T18:08:11Z,9637,121,1,0,5
897,React Project 2 Day 5 - Live Coding with Jesse,2017-07-26T20:19:39Z,3334,42,0,0,6
898,Chickens and Pigs - Agile Software Development,2017-07-26T14:00:04Z,7233,74,1,0,8
899,React Project 2 Day 4 - Live Coding with Jesse,2017-07-25T20:01:37Z,3653,40,5,0,7
900,Spelling With Chemistry - The Daily Programmer #302,2017-07-25T19:01:45Z,2774,69,2,0,9
901,The INVEST approach to product backlog items,2017-07-25T14:00:03Z,11563,103,5,0,1
902,React Project 2 Day 3 - Live Coding with Jesse,2017-07-24T20:08:07Z,5736,65,2,0,16
903,"jQuery: get and set with http, text, val, and attr - Beau teaches JavaScript",2017-07-24T00:48:27Z,13970,194,10,0,8
904,The Agile Manifesto - Agile Software Development,2017-07-22T22:20:25Z,4739,72,5,0,7
905,React Project 2 Day 2: Learning Material UI - Live Coding with Jesse,2017-07-21T20:28:05Z,23671,168,14,0,24
906,Jolly Jumper - The Daily Programmer #311,2017-07-20T21:53:37Z,4854,93,0,0,22
907,Starting a New React Project (P2D1) - Live Coding with Jesse,2017-07-20T21:02:35Z,42088,474,17,0,58
908,XOR Multiplication - The Daily Programmer #315,2017-07-20T01:08:21Z,3069,50,4,0,17
909,"""Finishing"" My React Site - Live Coding with Jesse",2017-07-19T20:09:01Z,1784,18,1,0,13
910,animate in jQuery - Beau teaches JavaScript,2017-07-19T18:20:10Z,6627,149,1,0,9
911,More React Refactoring - Live Coding with Jesse,2017-07-18T20:54:06Z,2029,34,1,0,6
912,Concatenated Integers - The Daily Programmer #314,2017-07-17T22:51:31Z,2493,77,0,0,12
913,jQuery effects - Beau teaches JavaScript,2017-07-16T17:50:30Z,8453,166,0,0,5
914,Collatz Tag System - The Daily Programmer #317,2017-07-15T19:33:39Z,2594,70,2,0,9
915,3Sum - The Daily Programmer #323,2017-07-14T21:39:53Z,32609,353,418,0,72
916,React: Refactoring Components - Live Streaming with Jesse,2017-07-14T20:58:55Z,2124,34,1,0,0
917,React: Working with API Data - Live Coding with Jesse,2017-07-13T23:14:20Z,3573,35,1,0,6
918,Condensing Sentences - The Daily Programmer #319,2017-07-13T00:12:24Z,9669,291,4,0,33
919,React/NextJS Routing and WordPress API Custom Types - Live Coding with Jesse,2017-07-12T20:40:14Z,4875,51,4,0,6
920,jQuery events - Beau teaches JavaScript,2017-07-12T16:08:24Z,10375,172,1,0,5
921,"React, NextJS, CSS - Live Coding with Jesse",2017-07-11T20:50:40Z,4637,63,4,0,2
922,Making a React Blog with WordPress Content - Live Coding with Jesse,2017-07-10T20:53:03Z,13701,176,11,0,7
923,Getting started with jQuery (tutorial) - Beau teaches JavaScript,2017-07-09T18:22:14Z,28439,403,4,0,23
924,Definition of Done - Agile Software Development,2017-07-09T01:46:46Z,17795,179,11,0,6
925,React: Building a New UI - Live Coding with Jesse,2017-07-07T21:21:52Z,4615,80,3,0,4
926,React: Sorting and Filtering Data Part 2 - Live Coding with Jesse,2017-07-06T19:28:50Z,4301,41,2,0,5
927,React: Sorting and Filtering Data - Live Coding with Jesse,2017-07-05T20:31:36Z,14518,78,13,0,3
928,A day at Pennybox with Co-Founder Reji Eapen,2017-07-05T17:11:19Z,4948,78,2,0,13
929,Working Agreement - Agile Software Development,2017-07-01T20:12:35Z,6564,65,5,0,1
930,Hero Section CSS Changes - Live Coding with Jesse,2017-06-30T20:36:24Z,2931,45,0,0,3
931,Should I go back to school to get CS degree? - Ask Preethi,2017-06-30T10:50:32Z,67254,1286,66,0,158
932,Submitting a PR to an Open Source Project - Live Coding with Jesse,2017-06-27T20:59:50Z,3477,55,0,0,2
933,React: Google Analytics Click Tracking - Live Coding with Jesse,2017-06-26T19:06:00Z,9499,62,24,0,19
934,Getting first React job without experience - Ask Preethi,2017-06-24T18:10:51Z,101160,1805,109,0,103
935,The Definition of Ready - Agile Software Development,2017-06-22T14:31:48Z,15357,176,4,0,6
936,A day at IBM with designer James Rauhut,2017-06-16T20:40:31Z,40071,562,16,0,30
937,Tradeoff Matrix - Agile Software Development,2017-06-16T00:37:23Z,5616,117,6,0,0
938,Geolocation Sorting by Distance - Live Coding with Jesse,2017-06-15T22:12:56Z,5077,86,1,0,5
939,React: Sortable Responsive Table - Live Coding with Jesse,2017-06-14T20:20:57Z,5576,43,3,0,1
940,React + Prettier + Standard JS - Live Coding with Jesse,2017-06-13T19:36:27Z,4601,53,6,0,11
941,Merging a Pull Request from GitHub - Live Coding with Jesse,2017-06-12T19:02:17Z,2629,47,1,0,16
942,Miscellaneous Front End Updates - Live Coding with Jesse,2017-06-09T20:02:48Z,2713,57,3,0,9
943,Dates - Beau teaches JavaScript,2017-06-09T19:56:57Z,17293,259,2,0,13
944,Creating WordPress Custom Post Types - Live Coding With Jesse,2017-06-08T19:40:40Z,3104,58,3,0,5
945,React: WordPress API Live Search - Live Coding with Jesse,2017-06-07T20:45:47Z,2968,53,1,0,4
946,React: Masonry Layout Part 2 - Live Coding with Jesse,2017-06-05T19:06:29Z,2249,21,3,0,9
947,Graphs: breadth-first search - Beau teaches JavaScript,2017-06-05T16:03:33Z,35049,369,23,0,24
948,Load Balancing: SSL Passthrough Setup - Live Coding with Jesse,2017-06-02T20:23:34Z,3416,29,0,0,2
949,"try, catch, finally, throw - error handling in JavaScript",2017-06-02T16:58:21Z,80453,1832,26,0,46
950,Load Balancing Digital Ocean Droplets - Live Coding with Jesse,2017-06-01T20:49:32Z,2930,60,5,0,5
951,React: Masonry Layout - Live Coding with Jesse,2017-05-31T19:25:19Z,7294,70,8,0,1
952,React: Setting Up Google Analytics - Live Coding with Jesse,2017-05-30T19:13:55Z,15841,117,20,0,8
953,Post Launch Updates - Live Coding with Jesse,2017-05-26T19:06:59Z,1727,26,0,0,8
954,Last Minute Updates - Live Coding with Jesse,2017-05-25T20:43:52Z,2047,33,4,0,0
955,Browser and Device Testing - Live Coding with Jesse,2017-05-24T19:03:49Z,2593,33,2,0,0
956,setInterval and setTimeout: timing events - Beau teaches JavaScript,2017-05-24T16:23:18Z,34688,606,12,0,26
957,React: Dealing with jQuery Issues - Live Coding with Jesse,2017-05-23T19:10:43Z,2840,43,1,0,2
958,React: Parameterized Routing with Next.js - Live Coding with Jesse,2017-05-22T18:58:14Z,6260,64,1,0,5
959,"Graph Data Structure Intro (inc. adjacency list, adjacency matrix, incidence matrix)",2017-05-21T01:51:53Z,72055,1036,111,0,54
960,Browser history tutorial - Beau teaches JavaScript,2017-05-18T17:04:02Z,27086,407,21,0,19
961,cookies vs localStorage vs sessionStorage - Beau teaches JavaScript,2017-05-16T20:32:18Z,134974,2995,35,0,89
962,React: Production Server Setup Part 2 - Live Coding with Jesse,2017-05-16T16:56:27Z,3620,37,6,0,11
963,React: Production Server Setup - Live Coding with Jesse,2017-05-15T16:20:16Z,8095,82,22,0,10
964,Heap Data Structure (max and min)- Beau teaches JavaScript,2017-05-13T18:25:16Z,25735,315,15,0,33
965,React: Server Side API Calls with Isomorphic Fetch - Live Coding with Jesse,2017-05-12T19:17:54Z,6497,74,3,0,14
966,A day at Amazon with developer Dave Jeffers,2017-05-12T16:17:01Z,128067,1134,165,0,104
967,React: Props - Live Coding with Jesse,2017-05-11T18:44:05Z,2326,46,2,0,1
968,Pop up boxes tutorial - Beau teaches JavaScript,2017-05-11T16:38:08Z,9841,161,0,0,6
969,React: Building Components - Live Coding with Jesse,2017-05-10T18:41:34Z,3188,41,1,0,22
970,React: Initial Setup - Live Coding with Jesse,2017-05-09T18:45:17Z,6507,118,1,0,18
971,"Window Object: move, open, close, & size - Beau teaches JavaScript",2017-05-09T17:07:02Z,26333,425,4,0,17
972,Hide/Show Section on Click - Live Coding with Jesse,2017-05-08T18:39:50Z,3988,61,3,0,7
973,Trie Data Structure - Beau teaches JavaScript,2017-05-06T17:26:07Z,23931,289,6,0,27
974,Material Design Cards - Live Coding with Jesse,2017-05-05T18:48:32Z,8245,117,7,0,14
975,requestAnimationFrame() - Beau teaches JavaScript,2017-05-05T17:30:40Z,28365,381,43,0,23
976,Building a Website: Team Page - Live Coding with Jesse,2017-05-04T18:42:10Z,6037,111,1,0,16
977,Building a Website (P1D2) - Live Coding with Jesse,2017-05-03T18:36:44Z,23917,316,9,0,26
978,Animation in the DOM - Beau teaches JavaScript,2017-05-03T16:17:25Z,30371,523,11,0,24
979,Mediator Design Pattern - Beau teaches JavaScript,2017-04-30T18:24:30Z,17879,347,10,0,29
980,DOM Nodes - Beau teaches JavaScript,2017-04-28T01:25:44Z,22257,416,8,0,9
981,addEventListener() - Beau teaches JavaScript,2017-04-24T17:38:46Z,85766,1204,25,0,53
982,Linked List - Beau teaches JavaScript,2017-04-22T17:27:52Z,64308,724,25,0,65
983,DOM Events - Beau teaches JavaScript,2017-04-20T17:09:50Z,22932,486,7,0,18
984,CSS styles in JavaScript (setting and getting) - Beau teaches JavaScript,2017-04-18T15:56:51Z,27492,467,4,0,16
985,Selecting & Changing Website Elements (DOM manipulation) - Beau teaches JavaScript,2017-04-17T17:59:04Z,88670,1257,13,0,42
986,Hash Tables - Beau teaches JavaScript,2017-04-14T21:09:11Z,52701,869,33,0,27
987,Check if a property is in an object - Beau teaches JavaScript,2017-04-13T22:12:12Z,12740,248,2,0,17
988,"Strict Mode — ""use strict"" - Beau teaches JavaScript",2017-04-12T16:15:02Z,27753,563,7,0,9
989,import / export (modules) - Beau teaches JavaScript,2017-04-11T15:52:33Z,47127,793,50,0,39
990,Immediately Invoked Function Expression - Beau teaches JavaScript,2017-04-10T17:39:31Z,38767,1039,10,0,35
991,Map data structure & ES6 map object - Beau teaches JavaScript,2017-04-09T20:55:53Z,31954,390,22,0,18
992,Get current URL with JavaScript (and jQuery) - Beau teaches JavaScript,2017-04-07T16:49:10Z,4792,94,1,0,2
993,Destructuring in ES6 - Beau teaches JavaScript,2017-04-06T16:26:51Z,48692,1548,18,0,84
994,Arrow Functions  - Beau teaches JavaScript,2017-04-05T16:18:03Z,33948,845,18,0,26
995,Binary Search Tree: Traversal & Height - Beau teaches JavaScript,2017-04-02T15:07:18Z,21084,224,7,0,14
996,Clean Code: Formatting and Comments - Beau teaches Javascript,2017-04-01T15:08:59Z,12887,306,8,0,13
997,THIS keyword - Beau teaches JavaScript,2017-03-31T17:34:54Z,41131,599,111,0,59
998,Strings: [bracket notation] - Beau teaches JavaScript,2017-03-29T17:38:57Z,24274,282,2,0,12
999,Copying Arrays (deep and shallow) - Beau teaches JavaScript,2017-03-28T18:23:51Z,29200,624,16,0,46
1000,for in / for of - Beau teaches JavaScript,2017-03-27T20:13:46Z,47352,1015,47,0,47
1001,Binary Search Tree - Beau teaches JavaScript,2017-03-26T19:50:46Z,66340,974,13,0,55
1002,"Clean Code: Testing, Concurrency, & Error Handling - Beau teaches JavaScript",2017-03-25T16:41:08Z,6798,151,2,0,1
1003,While / Do While - Beau teaches JavaScript,2017-03-24T16:20:56Z,21867,367,6,0,15
1004,String Basics - Beau teaches JavaScript,2017-03-23T17:15:31Z,23607,290,0,0,20
1005,Random numbers & parseInt - Beau teaches JavaScript,2017-03-23T09:12:28Z,22573,312,17,0,20
1006,...spread operator and rest operator - Beau teaches JavaScript,2017-03-22T18:04:50Z,79088,2976,31,0,120
1007,"Objects, part 2: Beau teaches JavaScript",2017-03-21T19:12:12Z,12803,190,0,0,4
1008,Logical operators && TRICKS with short-circuit evaluation - Beau teaches JavaScript,2017-03-20T16:44:04Z,40791,570,63,0,19
1009,Queues & Priority Queues - Beau teaches JavaScript,2017-03-19T19:32:07Z,29782,342,9,0,18
1010,Clean Code: SOLID - Beau teaches JavaScript,2017-03-18T18:54:26Z,45509,1006,66,0,21
1011,Designer and Entrepreneur Colm Tuite - Developer Interviews,2017-03-17T17:56:10Z,2511,47,1,0,2
1012,Arrays - Beau teaches JavaScript,2017-03-17T16:44:11Z,14971,193,1,0,7
1013,JS Books and Finishing Recipe Box - Code Vlog {23},2017-03-17T13:10:50Z,2037,25,1,0,4
1014,Classes - Beau teaches JavaScript,2017-03-16T16:56:37Z,28467,567,16,0,29
1015,Free Code Camp Backend Speed-Runs with Septimus,2017-03-15T17:10:27Z,2728,40,2,0,0
1016,Ternary Operator - Beau teaches JavaScript,2017-03-15T16:33:44Z,34152,760,5,0,32
1017,React Basics - Beau teaches JavaScript,2017-03-14T16:27:53Z,30507,511,27,0,27
1018,For Loops - Beau teaches JavaScript,2017-03-13T17:11:07Z,57390,970,31,0,76
1019,Struggle (building Recipe Box) - Code Vlog {22},2017-03-13T13:08:12Z,1161,18,0,0,5
1020,Clean Code: Classes - Beau teaches JavaScript,2017-03-11T17:36:47Z,9160,193,2,0,7
1021,"Array Iteration: 8 Methods - map, filter, reduce, some, every, find, findIndex, forEach",2017-03-10T21:46:55Z,71547,1903,27,0,88
1022,Recipe Box Routing and Storage - Code Vlog {21},2017-03-10T12:57:04Z,702,6,1,0,1
1023,Closures - Beau teaches JavaScript,2017-03-09T17:59:17Z,58369,1173,58,0,66
1024,Functions - Beau teaches JavaScript,2017-03-08T17:56:53Z,51926,811,20,0,37
1025,Numbers - Beau teaches JavaScript,2017-03-07T18:01:47Z,26461,306,4,0,16
1026,== vs === - Beau teaches JavaScript,2017-03-06T15:55:45Z,31461,556,16,0,34
1027,Recipe Box Components - Code Vlog {20},2017-03-06T11:54:41Z,1240,19,3,0,2
1028,Sets (data structure) - Beau teaches JavaScript,2017-03-05T14:00:06Z,24995,251,4,0,18
1029,Clean Code: Objects - Beau teaches JavaScript,2017-03-04T17:23:30Z,10763,237,8,0,10
1030,Symbols - Beau teaches JavaScript,2017-03-03T19:54:23Z,16814,308,33,0,23
1031,Remote Work - Code Vlog {19},2017-03-03T16:23:01Z,2019,59,1,0,1
1032,Desktop Notifications - Beau teaches JavaScript,2017-03-02T17:58:33Z,19036,409,3,0,25
1033,Variables - Beau teaches JavaScript,2017-03-01T18:40:28Z,136476,1159,14,0,41
1034,JSON - Beau teaches JavaScript,2017-02-28T18:41:20Z,15014,232,2,0,13
1035,Data Types - Beau teaches JavaScript,2017-02-27T17:40:31Z,44550,525,12,0,48
1036,Recipe Box Layout - Code Vlog {18},2017-02-27T12:59:34Z,862,15,0,0,5
1037,Singleton Design Pattern - Beau teaches JavaScript,2017-02-26T20:09:29Z,36416,422,12,0,24
1038,Clean Code: Functions (Part 2) - Beau teaches JavaScript,2017-02-25T18:50:30Z,13680,280,2,0,14
1039,Stacks (Data Structure) - Beau teaches JavaScript,2017-02-24T18:04:50Z,75657,789,6,0,48
1040,React: Camper Leaderboard - Code Vlog {17},2017-02-24T12:44:09Z,895,17,1,0,1
1041,Former Google Engineer Mike Turitzin on How to Organize Code - Senior Developer Skills,2017-02-23T19:09:22Z,6184,117,4,0,6
