,title,publication_date,viewCount,likeCount,dislikeCount,favoriteCount,commentCount,length
0,The End Is Near,2021-07-07T16:14:08Z,1875701,197695,950,0,8050,0 days 00:11:00
1,I Hate Optical Illusions..,2021-07-06T12:24:09Z,2556115,232796,1717,0,10003,0 days 00:12:41
2,Things Humans Were Never Meant To See...,2021-07-05T16:44:57Z,2379866,211043,1544,0,9115,0 days 00:10:29
3,Pewdiepie Minecraft Olympic Games,2021-07-04T16:52:00Z,1980526,91292,1405,0,1991,0 days 01:41:17
4,BTS stan changes race to Korean..,2021-07-02T17:29:13Z,3442064,314738,3135,0,41254,0 days 00:12:44
5,Kids Obsessions Needs to be Stopped..,2021-07-01T16:15:00Z,2743687,219489,2154,0,17445,0 days 00:12:47
6,Tik Toks That Will Melt your Brain...,2021-06-30T16:28:52Z,2766722,217908,2541,0,7520,0 days 00:09:53
7,Reacting To Strangers Secrets,2021-06-29T15:59:51Z,2730120,227624,2296,0,8829,0 days 00:11:54
8,I Trusted My Fans With This...,2021-06-23T17:01:23Z,3038885,267022,2496,0,11225,0 days 00:12:05
9,YouTuber House Tour Review,2021-06-22T17:05:11Z,3831806,287495,4020,0,18290,0 days 00:20:50
10,Tik Toks that makes you want to cancel nature..,2021-06-21T15:45:00Z,4076241,295704,2937,0,10924,0 days 00:18:27
11,"Brb,  The Army",2021-06-20T16:01:42Z,1434915,55844,1321,0,1309,0 days 02:15:21
12,Can Two Married Men Spot Who Is Unmarried?,2021-06-20T15:49:19Z,3596995,223583,1959,0,10531,0 days 00:36:14
13,NEVER Bring Your Minecraft Axolotl to the Nether.......,2021-06-19T16:43:03Z,4849970,341219,3327,0,14382,0 days 00:24:10
14,Playing best game ever made,2021-06-16T17:04:48Z,1975597,80757,1987,0,1924,0 days 03:45:05
15,Thank You,2021-06-16T16:43:10Z,3560403,354610,2636,0,18383,0 days 00:16:23
16,top 8941 marketing fails OF ALL TIME XD,2021-06-15T16:38:19Z,3089690,250843,2076,0,10543,0 days 00:13:07
17,New Minecraft Update is a disaster..,2021-06-14T16:16:15Z,5441793,431986,6474,0,18641,0 days 00:22:17
18,Big Ed Returns With More Cringe Xd,2021-06-09T17:00:04Z,4860340,326241,3590,0,22517,
19,Tik Toks That Makes Me Laugh,2021-06-08T16:35:21Z,3367295,259299,2891,0,8221,0 days 00:14:11
20,I am being slandered online..,2021-06-07T15:14:15Z,2890903,260982,2595,0,13372,0 days 00:15:06
21,Karen Compilation 4k Most Bruh Moment  2020,2021-06-05T16:17:19Z,4558054,323935,3031,0,20010,0 days 00:22:39
22,Strangers Rank Their Intelligence Is KARMA,2021-06-04T17:14:40Z,4644696,389889,4367,0,31131,0 days 00:21:21
23,What the new UFO Pentagon Footage Tells us..,2021-06-03T16:15:01Z,2900066,295264,3844,0,25060,0 days 00:13:25
24,My Response to...,2021-05-28T16:30:05Z,4109119,312870,4379,0,15805,0 days 00:16:24
25,Are Ghosts Real? (Proof),2021-05-27T16:30:05Z,3982831,288286,2610,0,24191,0 days 00:26:15
26,✨Try Not To Get Satisfied Challenge ✨,2021-05-26T16:45:02Z,3043280,277452,2758,0,10559,0 days 00:13:51
27,Reacting to 6 Bros vs 1 Secret PewDiePie,2021-05-25T16:31:04Z,3227481,285690,1517,0,10267,0 days 00:21:11
28,Funniest Tik Tok Of ALL TIME xD,2021-05-24T17:20:37Z,3596713,290400,3185,0,9801,0 days 00:14:35
29,Reacting To My Wifes Favorite Clips,2021-05-21T17:15:00Z,4903693,404960,4163,0,13173,0 days 00:13:50
30,Someone found my old Reddit posts... its bad,2021-05-18T18:17:06Z,2940581,262978,2163,0,12028,0 days 00:12:42
31,64 Year Old Man Loved Balloons... Too Much,2021-05-17T16:45:00Z,2355739,166331,1743,0,9791,0 days 00:21:28
32,Biomutant - New Game LIVE,2021-05-16T20:17:30Z,3501166,102280,2467,0,2863,0 days 03:55:18
33,Tik Tok But Please Make it Stop,2021-05-14T17:15:01Z,3987153,317524,3657,0,10255,0 days 00:13:29
34,Reacting To The Worlds Biggest House  ($500 000 000),2021-05-13T17:41:21Z,4629680,281703,3439,0,23447,0 days 00:42:49
35,Resident Evil 8 Village #6 / Surprisingly Good Ending!,2021-05-12T12:32:24Z,2755476,111240,1620,0,5358,0 days 02:35:28
36,Unluckiest People Caught in 4K,2021-05-11T17:00:31Z,4287783,341632,3258,0,9677,0 days 00:11:03
37,Resident Evil 8 Village #5 - Heisenberg is the Greatest,2021-05-11T15:30:24Z,2634850,94449,1247,0,2482,0 days 02:22:02
38,Someone Hackedf Me And Stole My Private Hidden Videos..,2021-05-10T16:45:02Z,2828367,250252,1905,0,16139,0 days 00:13:03
39,Resident Evil 8 Village #4 - The First Scare So Far!,2021-05-10T14:36:32Z,2850851,100311,1343,0,3446,0 days 02:28:41
40,Resident Evil 8 Village #3 - I HATE BABIES,2021-05-09T11:46:02Z,3023536,110091,1562,0,4168,0 days 01:53:23
41,Resident Evil 8 Village #2 - Sorry Mom,2021-05-08T11:56:59Z,3315874,114536,1521,0,4412,0 days 01:58:41
42,I've Become Enlisted..,2021-05-07T16:26:08Z,2088237,129479,1989,0,9399,0 days 00:19:28
43,Resident Evil 8 Village #1 - Mommy / Gameplay / Full Playthrough,2021-05-07T11:05:04Z,5759073,231298,2721,0,8376,0 days 02:27:21
44,How Rare Is Your DNA?,2021-05-06T16:48:50Z,3769514,265440,2759,0,12184,0 days 00:26:52
45,I am Knife Flipp Master 2021,2021-05-05T16:44:25Z,2540459,231739,2110,0,16759,0 days 00:09:52
46,I made a promise..,2021-05-04T16:55:21Z,3715107,374512,2161,0,13668,0 days 00:12:32
47,Going Through Your Partners Phone...,2021-05-03T17:05:53Z,4909881,328347,2336,0,12923,0 days 00:25:23
48,Shy Kid Gets Humiliated At School Ft. PewDiePie | Jacksepticeye,2021-04-29T16:39:30Z,3493924,298587,3808,0,13030,0 days 00:13:00
49,I Found The Greatest Tik Tok,2021-04-28T16:41:42Z,4378853,332343,3837,0,10851,0 days 00:15:28
50,"Try Not Laugh, But Loser has to Sing *ft Jackepticeye",2021-04-27T16:46:44Z,5007371,424732,2925,0,17457,0 days 00:22:45
51,The Battle of Josh will be recorded in History Books,2021-04-26T17:17:41Z,2992161,255627,2011,0,13191,0 days 00:12:56
52,Man's In Love With His Car.. (gone bananas),2021-04-23T16:45:01Z,3758922,282860,2829,0,25797,0 days 00:12:03
53,CANCEL BREAD,2021-04-21T16:32:04Z,4715698,282110,3011,0,15061,0 days 00:29:35
54,"Tik Tok Is Cringe, but some are good",2021-04-20T16:30:09Z,4303298,364388,3365,0,11613,0 days 00:12:11
55,Rick Astley Hosts Meme Review 👏👏,2021-04-19T17:14:41Z,4202734,400640,5447,0,17990,0 days 00:15:33
56,Getting Cancelled Speedrun Any%,2021-04-18T17:15:00Z,3486061,282119,2105,0,13769,0 days 00:11:33
57,Before your eyes -- A game that changes when you blink,2021-04-16T16:36:41Z,7470923,357732,3801,0,15435,0 days 01:37:56
58,Being Shy is a Superpower..,2021-04-14T17:56:43Z,4608890,299025,56375,0,79434,0 days 00:30:18
59,Tik Tok is Cringe,2021-04-13T18:18:43Z,6388947,456323,5769,0,27355,0 days 00:17:49
60,I Get RickRolled = The Video Ends.,2021-04-12T16:32:53Z,4797988,453733,3358,0,16419,0 days 00:12:50
61,Hillbilly Cheapskate Is The Worst Kind....,2021-04-08T16:33:07Z,4694326,286653,2602,0,22671,0 days 00:30:11
62,How much does Pewdiepie Make,2021-04-07T14:27:54Z,4896508,463294,4106,0,25644,0 days 00:11:53
63,Pewdiepie Died (Felix Kjellberg Reacts),2021-04-06T16:55:37Z,4044678,344958,2183,0,16246,0 days 00:18:41
64,I am Smarter than Reddit,2021-04-05T16:51:25Z,2892045,255406,2972,0,11922,0 days 00:11:25
65,Cringe Compilations Needs to be STOPPED,2021-04-02T18:08:51Z,5641363,372954,4034,0,17320,0 days 00:21:52
66,My Minecraft Addiction Needs to be STOPPED,2021-04-01T16:45:00Z,5091404,340535,4419,0,20085,0 days 00:18:44
67,Seniors Needs to be STOPPED!,2021-03-31T17:33:54Z,4532116,275291,2652,0,19052,0 days 00:37:08
68,No Beard Filter Needs to Be STOPPED,2021-03-30T15:15:01Z,3472436,347173,2050,0,14981,0 days 00:14:52
69,Woman Addicted to Eating Matressess,2021-03-28T18:42:49Z,5102334,335747,2932,0,24878,0 days 00:26:58
70,Responding To My Minecraft Crimes...,2021-03-26T18:21:16Z,4853220,375838,2640,0,12075,0 days 00:15:50
71,Minecraft Is Easy,2021-03-25T17:15:03Z,4908189,355096,3146,0,21826,0 days 00:25:17
72,Tik Tok Isnt Funny YLYL (I didnt laugh),2021-03-24T17:15:00Z,4898000,393109,3675,0,17128,
73,I bought a new camera (240p),2021-03-23T18:27:42Z,4702373,517050,3554,0,28941,0 days 00:17:12
74,Millenial CHEATS To Win $1000,2021-03-20T20:44:39Z,4471755,291172,3688,0,24460,0 days 00:28:14
75,The World Strongest Family...,2021-03-19T17:05:25Z,5540411,372560,3163,0,22671,0 days 00:18:20
76,I'm Done With Minecraft Now..,2021-03-18T18:15:00Z,4596700,398205,2915,0,21741,0 days 00:21:37
77,Inventions That Will CHANGE YOUR LIFE!,2021-03-17T17:15:01Z,3745570,301384,2601,0,12961,0 days 00:14:36
78,🔴 LWIAY  LIVE 🔴,2021-03-16T19:10:19Z,2382571,198150,1909,0,7143,0 days 00:28:31
79,Playing Minecraft With You Guys,2021-03-13T19:25:31Z,2982023,113829,1830,0,3358,0 days 02:32:17
80,YouTubers Morning Routine..,2021-03-12T18:17:26Z,5082155,354675,3506,0,27045,0 days 00:21:43
81,Ender Dragon Hardcode.. I almost died... - Minecraft Hardcore #19,2021-03-11T18:52:21Z,3894102,318643,2072,0,16817,0 days 00:18:14
82,Woman Addicted To Eating Sand..,2021-03-10T18:46:12Z,3658279,300676,2172,0,33662,0 days 00:17:07
83,Big Hero 6 Mom Is a Lie...  [MEME REVIEW] 👏 👏#88,2021-03-09T19:40:51Z,5398150,418165,4835,0,15444,0 days 00:10:30
84,DailyDose Predicted My Future - LWIAY #00153,2021-03-08T18:00:58Z,4024932,332730,2341,0,14327,0 days 00:13:45
85,The Biggest Liar Cheapstake! - TLC #16,2021-03-05T17:45:01Z,4421982,295368,2197,0,15626,0 days 00:11:09
86,I Speedrun Minecraft - Minecraft Hardcore #18,2021-03-04T17:30:01Z,4434372,332078,3122,0,17442,0 days 00:17:51
87,Sweden Invented Tanks,2021-03-03T18:00:13Z,1826007,130240,3025,0,8546,0 days 00:12:27
88,Mr Beast... I am SO SORRY! - LWIAY #00152,2021-03-02T17:15:02Z,6412359,513417,4569,0,22866,0 days 00:14:44
89,I read a book...,2021-02-26T17:34:13Z,2448054,238950,2486,0,23624,0 days 00:16:13
90,The Most Annoying Video on the Internet,2021-02-25T17:47:01Z,8220212,613541,4761,0,51904,0 days 00:30:50
91,Planet Fitness Gym Are Hypocrites,2021-02-24T17:09:10Z,5630682,382506,2980,0,21464,0 days 00:15:11
92,My Minecraft Storage System Makes All Girls Go Crazy - - Minecraft Hardcore #17,2021-02-23T17:45:00Z,4414346,308756,1900,0,15523,0 days 00:20:35
93,Stardew Valley - Part 1 - Cope Stream,2021-02-21T19:02:13Z,3607825,137365,2407,0,5332,0 days 05:33:26
94,Kids Decide Who Gets $1000 Is Very Cringe...,2021-02-18T19:27:02Z,7591027,505045,4113,0,44098,0 days 00:33:22
95,I Love Kids -  - LWIAY #00151,2021-02-17T17:55:35Z,6412100,582026,3812,0,34656,0 days 00:12:49
96,Americas Cheapest Family... - TLC #15,2021-02-13T17:45:01Z,8258644,518510,5433,0,36952,0 days 00:21:53
97,I WAS TOLD THIS WOULD WORK AAAAAAAAAAAH - - Minecraft Hardcore #16,2021-02-12T19:01:35Z,4628430,349666,2463,0,19638,0 days 00:22:31
98,Kids Are Very Dumb /r/Kidsarefingstupid REDDIT REVIEW #85,2021-02-10T17:30:01Z,4832580,387809,4529,0,19062,0 days 00:10:56
99,Minecraft Hardcore Woodland Mansion Is Awful..  - Minecraft Hardcore #15,2021-02-09T17:39:54Z,4650719,351378,2235,0,20321,0 days 00:22:07
100,I Hate Kids - - LWIAY #00150,2021-02-08T20:08:32Z,5205983,493455,5527,0,28741,0 days 00:23:00
101,I Found An Igloo In Minecraft (Life changing)  - Minecraft Hardcore #14,2021-02-05T18:56:29Z,6392724,394707,4461,0,21954,0 days 00:23:59
102,Responding To The VTuber Controversy (omg),2021-02-04T18:15:33Z,3802422,366824,4076,0,43387,0 days 00:09:44
103,How High Can You Survive A Jump in Minecraft? - Minecraft Hardcore #13,2021-02-03T17:30:01Z,4074370,334515,2466,0,14466,0 days 00:14:49
104,My Face Reveal 2.0 - LWIAY #00149,2021-02-02T17:20:38Z,4633937,418803,5642,0,36547,0 days 00:11:43
105,This Is Bad... - Minecraft Hardcore #12,2021-02-01T18:13:01Z,4695333,305205,3135,0,20166,0 days 00:29:56
106,I Made 58024 Furnaces in Minecraft & This Happened..  - Minecraft Hardcore #11,2021-01-28T19:02:34Z,5977603,345885,5300,0,26471,0 days 00:29:08
107,How to Find Netherite EASY - Minecraft Hardcore #10,2021-01-26T17:27:57Z,6188093,370559,4716,0,22938,0 days 00:27:20
108,I Did A DNA Test... (I Guess Im Cancelled Now),2021-01-25T18:45:01Z,4266022,374288,6621,0,26767,0 days 00:09:55
109,Rescuing Villagers in Minecraft   - Minecraft Hardcore #9,2021-01-24T16:30:03Z,4477903,319260,4299,0,23343,0 days 00:18:58
110,I'm Back With A Huge Announcement! LWIAY #00148,2021-01-23T18:12:43Z,6433279,626379,9056,0,41224,0 days 00:19:08
111,2020 Is GONE,2021-01-01T18:31:22Z,5102944,551421,4127,0,32032,0 days 00:07:18
112,Running Minecraft on MAX Graphics 16k - Minecraft Hardcore #8,2020-12-31T13:35:37Z,8332293,502873,5854,0,27913,0 days 00:19:17
113,Joining The Navy,2020-12-30T16:30:57Z,3029768,190619,3366,0,13708,0 days 00:15:41
114,Reacting to Winning Most Handsome Face 2020,2020-12-29T18:10:44Z,8134172,662024,5257,0,22856,0 days 00:18:29
115,I lost my best friend...  - Minecraft Hardcore #7,2020-12-28T17:49:17Z,5409340,423420,3021,0,32792,0 days 00:22:23
116,Animal Crossing Christmas With Marzia Special,2020-12-25T17:30:05Z,4040491,309714,2474,0,15671,
117,We are NOT the neighbours kids..! [MEME REVIEW] 👏 👏#87,2020-12-24T16:48:49Z,6535835,390295,3373,0,17262,0 days 00:42:34
118,Nooooooooooooooooo - Minecraft Hardcore #6,2020-12-22T18:52:38Z,5550893,416635,4371,0,26642,0 days 00:18:09
119,#THANKSMAS Cyberpunk Part 4 / Among Us End,2020-12-21T22:54:30Z,2007212,76319,1427,0,2129,0 days 02:08:41
120,Uh oh... LWIAY #00147,2020-12-21T18:17:39Z,6850267,508388,3362,0,19000,0 days 00:17:28
121,Cyberpunk - pART 5,2020-12-17T18:03:38Z,1653254,49117,1656,0,2590,0 days 02:52:22
122,I actually hate this - Minecraft Hardcore #5,2020-12-17T17:59:12Z,5178570,363805,3297,0,19576,0 days 00:24:14
123,Minecraft with Carson,2020-12-16T22:06:33Z,4541587,157602,3207,0,7000,0 days 02:01:58
124,Funny Gameshow Fails,2020-12-16T17:30:08Z,5566265,347099,3158,0,12644,0 days 00:15:19
125,I'm Quitting Minecraft Forever..  - Minecraft Hardcore #4,2020-12-15T18:15:18Z,5866782,423760,4094,0,21522,0 days 00:26:23
126,Cyberpunk 100% Story No fun Here - Part 4,2020-12-14T19:19:47Z,1719909,52755,1105,0,1543,0 days 02:18:18
127,I'm a Hypocrite... #exposed  LWIAY #00146,2020-12-14T18:50:05Z,3938081,333803,1896,0,14211,0 days 00:19:03
128,KEANU TIME ! Cyberpunk Full Playthrough Gameplay Part 3,2020-12-12T18:15:50Z,2956386,83004,2533,0,3148,0 days 03:23:29
129,I Made a Huge Mistake in the Nether - Minecraft Hardcore #3,2020-12-11T18:12:25Z,5066680,352073,2973,0,18101,
130,JOJO REFERENCE / Cyberpunk Full Playthrough Gameplay Part 2,2020-12-11T15:03:15Z,2242389,84600,2289,0,2305,0 days 02:07:13
131,Slender - Revisiting Slender is Pure Nostalgia..,2020-12-10T17:45:00Z,3220310,247780,1833,0,16549,0 days 00:20:42
132,Cyberpunk Full Playthrough Gameplay Part 1 / Love it so far!,2020-12-10T15:59:08Z,6186499,196192,4188,0,5521,0 days 03:00:56
133,Never Dig Straight Down... Minecraft Hardcore #2,2020-12-09T21:17:35Z,6299544,435426,3925,0,22816,0 days 00:21:55
134,I wrote a Song - LWIAY #00145,2020-12-08T17:30:00Z,3898861,349688,3130,0,15845,
135,Minecraft But I regret Everything.. - Minecraft Hardcore #1,2020-12-07T17:15:01Z,8145012,651386,5024,0,35703,0 days 00:21:23
136,Among Us Got Talent - Among Us #13,2020-12-03T18:15:01Z,4413961,292485,2955,0,10766,0 days 00:23:51
137,Pewdiepie without context,2020-12-02T17:15:02Z,7094561,545743,3699,0,19751,0 days 00:19:58
138,Ranking Guys Based on Apperance -  Jubilee React #15,2020-12-01T17:15:00Z,5834281,441058,3247,0,26210,0 days 00:16:58
139,Santa Is Cancelled on Twitter - - LWIAY #00144,2020-11-30T17:39:16Z,3833406,327589,2815,0,17469,
140,Pewdiepie Cringe Submissions,2020-11-27T17:30:02Z,4232495,306092,4008,0,16682,0 days 00:18:10
141,Proximity Chat in Among us!  - Among Us #12,2020-11-26T17:45:00Z,8453776,513975,5194,0,19157,0 days 00:23:38
142,Gym Fails is Hilarious!,2020-11-25T17:00:24Z,8394583,494052,10379,0,30572,0 days 00:15:45
143,I kept this hidden for 10 years.. - - LWIAY #00143,2020-11-23T18:15:01Z,5326035,413043,3856,0,18686,
144,Reviewing Memes With KSI  [MEME REVIEW] 👏 👏#86,2020-11-22T16:12:28Z,14609437,1325096,9738,0,73076,0 days 00:31:38
145,She Showers With Her MOM?! - TLC #14,2020-11-20T19:15:00Z,7030860,426530,4449,0,29226,
146,Instant Regret.. - #86[REDDIT REVIEW],2020-11-19T18:34:21Z,5236027,408877,2910,0,12691,0 days 00:08:15
147,Going Through My OLD Instagram (+ announcement),2020-11-18T17:45:01Z,4317581,383324,2612,0,20008,0 days 00:21:18
148,Doctor Reacts To my Injury (serious) - LWIAY #00142,2020-11-16T18:34:41Z,5703168,408295,3540,0,16591,0 days 00:19:00
149,Ranking Girls by Appearance - Jubilee React #14,2020-11-13T18:15:53Z,6991095,505375,8631,0,41046,0 days 00:16:32
150,What do I regret with my YouTube career? / QnA,2020-11-12T19:41:37Z,3247516,305610,2366,0,20484,0 days 00:18:07
151,Things we all have done - #85[REDDIT REVIEW],2020-11-11T17:15:25Z,5443369,371553,4545,0,19168,0 days 00:16:27
152,There is no video / There is No Game,2020-11-10T18:56:59Z,5332225,359731,3911,0,19732,0 days 00:33:27
153,This is absolutely NOT Funny - LWIAY #00141,2020-11-09T18:18:12Z,5401436,424449,3319,0,23831,0 days 00:19:37
154,0.000578% Chance Among Us Impostor - Among Us #11,2020-11-05T17:00:13Z,9652560,490957,5009,0,17834,0 days 00:29:47
155,Stop doing this.. - #84[REDDIT REVIEW],2020-11-04T17:59:51Z,4434720,332918,3120,0,13786,0 days 00:12:12
156,He married his daughters age - TLC #14,2020-11-03T18:36:39Z,8181966,493193,4928,0,49316,0 days 00:19:43
157,Update Vlog - LWIAY #00140,2020-11-02T18:02:51Z,6813126,533420,3666,0,26290,0 days 00:17:47
158,The Ultimate Among Us Impostor Duo - Among Us #10,2020-10-30T18:15:05Z,8510388,513740,5886,0,19564,0 days 00:16:30
159,Top Airline Passenger Freakout Cringe,2020-10-29T18:00:02Z,6913477,424223,5552,0,26099,0 days 00:17:26
160,VR was created for this - Phasmophobia /w Jacksepticeye,2020-10-28T17:30:00Z,3758725,233133,1975,0,10772,0 days 00:17:48
161,Random Boss battles #83[REDDIT REVIEW],2020-10-27T18:15:00Z,5516223,409535,3450,0,23483,0 days 00:12:20
162,YouTube Banned Me... (the truth) LWIAY #00139,2020-10-26T17:07:35Z,5994504,635818,4352,0,52245,0 days 00:18:37
163,fUNNIEST gAME oN sTEAM / Party Animals,2020-10-23T16:55:27Z,6011412,360577,3318,0,19177,0 days 00:26:22
164,97% of people cant tell what this is  #82[REDDIT REVIEW],2020-10-22T16:45:00Z,4302600,340125,3540,0,24074,0 days 00:11:52
165,Among Us New Update Is Hilarious - Among Us #9,2020-10-20T16:30:02Z,11200483,449218,5067,0,16443,0 days 00:42:42
166,Amnesia Rebirth - Its been 10 Years..,2020-10-19T17:01:05Z,6447352,508032,2843,0,28837,0 days 00:51:41
167,This was a mistake.. - LWIAY #00138,2020-10-18T18:05:11Z,6252611,507659,3111,0,22519,0 days 00:21:22
168,Donating A lot of Money  - YLYL #0072,2020-10-15T17:15:03Z,8149696,652298,5600,0,25778,0 days 00:14:03
169,This was very Cringe.. Among Us #8,2020-10-14T17:41:53Z,6883829,392766,5072,0,17948,0 days 00:20:56
170,Among Us Is Mildly Infuriating  #81[REDDIT REVIEW],2020-10-13T18:09:15Z,4400117,301407,3188,0,12194,0 days 00:19:32
171,Man Got Catfished - TLC #14,2020-10-12T17:15:01Z,13168607,679991,7809,0,48395,0 days 00:21:10
172,KSI Challenged Me (response).. - LWIAY #00137,2020-10-11T18:05:19Z,7058089,629854,3903,0,25683,0 days 00:17:56
173,A Horror With A Twist..,2020-10-08T16:00:01Z,4073676,266061,2733,0,16193,0 days 00:24:58
174,My Best Impostor Game in Among Us #7,2020-10-07T15:30:01Z,9259440,396453,4631,0,28678,0 days 00:36:07
175,Most Fun Horror Game IN YEARS,2020-10-06T15:30:02Z,6113399,364524,2765,0,15095,0 days 00:22:29
176,Nice Try KSI - Among us #6,2020-10-05T16:05:47Z,12626017,630176,5814,0,35429,0 days 00:40:59
177,Cursed Comments Has Gone Too Far... #81[REDDIT REVIEW],2020-10-02T16:33:09Z,6457876,490648,4947,0,23873,
178,Funny Among Us Memes Haha / [MEME REVIEW] 👏 👏#85,2020-10-01T16:46:02Z,7535048,565379,5835,0,23783,0 days 00:14:28
179,I'm The Greatest At Lying - Among Us #5,2020-09-30T15:54:49Z,7705067,418761,3398,0,16527,0 days 00:21:35
180,Ending the Drama - LWIAY #00136,2020-09-29T16:38:21Z,5114855,412707,3522,0,19214,0 days 00:21:34
181,Among Us But I RAGE QUIT #4,2020-09-25T17:00:52Z,6943356,381309,5152,0,21269,0 days 00:16:08
182,You Laugh You Donate - YLYL #0071,2020-09-24T16:09:55Z,6865869,642849,12928,0,24560,
183,There Are No Accidents... /r/Theyknow  #80[REDDIT REVIEW],2020-09-23T17:02:09Z,6034757,373172,3146,0,14825,0 days 00:12:34
184,The Biggest Lie of Me EXPOSED - LWIAY #00135,2020-09-22T16:57:06Z,5526443,416731,4116,0,26848,0 days 00:20:59
185,How to Win at Among Us (100% Effective) // #3,2020-09-21T17:26:02Z,8901788,394695,4869,0,17690,0 days 00:28:02
186,The YouTube Algorithm needs to be STOPPED,2020-09-20T17:03:56Z,6306075,513872,3789,0,22196,0 days 00:17:15
187,Among Us But IQ is -500 // #3,2020-09-17T17:36:23Z,9484292,449365,4047,0,18107,0 days 00:33:29
188,My Minecraft was HACKED - Minecraft - Part 46,2020-09-16T18:03:48Z,5071568,389289,5011,0,26137,0 days 00:14:14
189,Just Another Day In Russia  - #79[REDDIT REVIEW],2020-09-15T17:27:38Z,6364359,479118,5583,0,34881,0 days 00:14:47
190,Among Us but IQ is 600 // #2,2020-09-14T17:12:36Z,14167570,713971,9343,0,25336,0 days 00:22:59
191,Reacting to Our Child... - LWIAY #00134,2020-09-13T15:31:03Z,7008333,670915,4652,0,22145,0 days 00:18:56
192,I Spent $500 on Magic to Amaze my Wife,2020-09-10T15:10:32Z,6486138,498420,5346,0,32526,0 days 00:14:45
193,Among us / I Lie to YouTubers.. // #1,2020-09-09T17:15:33Z,14800337,802149,9185,0,33674,0 days 00:23:29
194,/ Green Needle // Brainstorm / - Which one do you hear?  #78[REDDIT REVIEW],2020-09-08T16:15:04Z,4243846,339330,2897,0,20122,0 days 00:14:57
195,He has to Pick One as WIFE / TLC #13,2020-09-07T16:15:03Z,7808240,401397,3449,0,24671,0 days 00:22:16
196,No. More. Simping.. 🛑🛑🛑 - LWIAY #00133,2020-09-06T16:15:03Z,6266951,495782,5752,0,24879,0 days 00:18:19
197,Judging Our Fans! w/ Jacksepticeye,2020-09-03T17:12:10Z,5008319,402100,5019,0,20583,0 days 00:28:29
198,THIS is the MOST INSANE couple.. TLC #12,2020-09-02T15:16:37Z,6970624,409634,3336,0,22934,0 days 00:18:38
199,The LOUDEST Sound in the World.. w/ Jacksepticeye,2020-09-01T16:02:47Z,3380221,341618,3796,0,20726,
200,Fall Guys: Live Hedgehog Edition!,2020-08-31T15:29:20Z,3891279,355840,4184,0,19669,0 days 00:12:00
201,"Mr Beast, It pains me to do this - LWIAY #00132",2020-08-30T15:01:53Z,8249743,605601,9122,0,29748,
202,Surgeon Simulator 2 - Coop /w Ken - THE NOSTALGIA IS REAL!,2020-08-28T15:49:54Z,3178236,115900,3218,0,4746,0 days 01:59:58
203,Reacting To My Deepfakes..,2020-08-27T17:26:13Z,5418268,396998,2923,0,16818,0 days 00:12:09
204,Flying Into My House in Flight Simulator 2020,2020-08-26T17:25:59Z,6039064,368859,5827,0,24139,0 days 00:29:24
205,Someone Is Selling My 50 MIL Award On Ebay #77[REDDIT REVIEW],2020-08-25T17:21:48Z,6335395,419357,4719,0,15728,
206,Mr Beast Made Someone Lose 800000 Because of Me   - LWIAY #00131,2020-08-24T17:15:04Z,6888948,538225,5096,0,22731,0 days 00:21:15
207,Tambourine Tower to the Moon.,2020-08-23T16:00:45Z,4898129,550383,4145,0,47984,0 days 00:22:56
208,Am I Straight? - Jubilee React #14,2020-08-20T18:15:00Z,8141312,562287,7883,0,35087,0 days 00:18:24
209,Reacting To My Public Appearances,2020-08-19T15:00:07Z,8213636,626462,3758,0,28573,
210,HmMmMmMmMmMmMmMmMmMHmMmMmMmMmMmMmMmMmMmMmMmMmMmMm #76[REDDIT REVIEW],2020-08-18T16:15:00Z,5406666,491928,5521,0,27548,0 days 00:10:19
211,I Got Scammed  - LWIAY #00130,2020-08-17T16:15:03Z,5756889,404006,3701,0,19093,0 days 00:20:06
212,I Make Swedish Bread And Fail Completely,2020-08-16T15:51:42Z,4060524,343099,2673,0,27883,
213,$20 Vs $700 Drink Test.. (epic fail cringe),2020-08-14T17:51:53Z,4842265,458378,4719,0,27038,0 days 00:17:59
214,Fall Guys ALL WINS Get in here!,2020-08-13T17:54:14Z,7584631,270126,6231,0,7060,0 days 02:16:04
215,This Subreddit Needs to be STOPPED! #75[REDDIT REVIEW] /r/MEIRL,2020-08-12T19:30:30Z,4864345,359314,5034,0,18531,
216,Why is Everyone is Singing Baka Mitai??  [MEME REVIEW] 👏 👏#84,2020-08-11T16:15:01Z,6758098,456409,6768,0,24035,0 days 00:13:56
217,Who is not Straight? Jubilee React #13,2020-08-10T15:59:25Z,8861479,631513,6456,0,44812,0 days 00:20:16
218,This is absolutely NOT Funny... LWIAY #00129,2020-08-09T17:59:16Z,5721621,411373,3744,0,34021,0 days 00:20:22
219,I Got Cancelled Again..,2020-08-06T16:07:10Z,6342958,613869,5965,0,51987,0 days 00:11:22
220,Simp Police is exposing Simps  #74[REDDIT REVIEW],2020-08-05T17:59:45Z,7186426,455798,4937,0,22803,
221,The Most Insane Couple Ever.. TLC #11,2020-08-04T17:31:27Z,7356278,418974,3431,0,28433,0 days 00:25:16
222,Speech Expert Analyses My Voice *10 Years ago to Now*,2020-08-03T15:44:57Z,4416801,407753,2401,0,19621,0 days 00:15:38
223,Ghost of Tsushima #6 - 1 DEATH = 10 PUSH UPS,2020-08-03T11:36:51Z,1700850,63195,2196,0,1256,0 days 02:56:07
224,Ghost of Tsushima #5 -  -100 DEATHS,2020-08-03T11:36:49Z,1074234,45746,1466,0,623,0 days 02:39:09
225,Ghost of Tsushima #2 - THIS GAME EPIC,2020-08-03T11:32:10Z,1589447,59630,1827,0,979,0 days 03:00:45
226,Ghost of Tsushima #3 - Ugliest Armor Secret Unlock,2020-08-03T11:32:10Z,1134314,32003,1125,0,447,0 days 02:13:01
227,Ghost of Tsushima / Ending,2020-08-03T11:32:10Z,1637413,66455,2163,0,1410,0 days 03:34:07
228,Ghost of Tsushima #4 -  0 DEATHS,2020-08-03T11:32:10Z,1838525,78390,2741,0,762,0 days 03:51:25
229,Ghost of Tsushima #9 - ACT 3 IS NOT EPIC DONT WATCH,2020-08-03T11:32:10Z,2437470,80464,3346,0,596,0 days 03:23:56
230,Ghost of Tsushima #8 Lethal Mode Im Pro Gamer Joe Rogan bad,2020-08-03T11:32:10Z,1148595,52889,1633,0,496,0 days 02:07:01
231,Ghost of Tsushima #10 - We finishing this NOW,2020-08-03T11:32:10Z,1027336,36915,1324,0,407,0 days 02:39:03
232,Please dont hate me for this.. LWIAY #00128,2020-08-02T18:55:12Z,6549148,485337,5660,0,28915,0 days 00:23:16
233,Picking Between 30 girls! Jubilee React #12,2020-07-31T17:36:24Z,6233582,419014,4379,0,27339,0 days 00:19:48
234,How dare you say this to me Joe Rogan!,2020-07-30T15:52:22Z,5477960,427443,6746,0,37414,
235,This is Unacceptable!~ #73[REDDIT REVIEW],2020-07-29T16:30:01Z,4766417,365114,4011,0,17777,0 days 00:18:36
236,Couple Coach React to Pewdiepie & Marzia,2020-07-27T17:30:40Z,5633453,423157,2977,0,45481,0 days 00:15:44
237,Ghost of Tsushima #7 - 1 DEATH = 20 CRUNCHES,2020-07-26T18:26:08Z,975701,42543,1206,0,796,0 days 01:51:08
238,Belle Delphine must be stopped... LWIAY #00127,2020-07-26T16:24:28Z,11849051,846615,10107,0,38192,0 days 00:16:50
